author,comment,URL,Comment Time,Crawl Time
Lachimanus,"Since people of the apple like to pay a little more for their phone:

Why not pay money for quality websites?",https://www.reddit.com/r/malaysia/comments/7enkwk,2017-12-29 07:39:22,2021-04-2316:01:32
runnercto,MODS!!! Make this post an announcement!!,https://www.reddit.com/r/malaysia/comments/7enkwk,2017-11-22 11:32:08,2021-04-2316:01:32
acid69,"These are the emails of those in the FCC who will most likely vote against net neutrality, let them know you oppose of it and spread the word!

ajit.pai@fcc.gov

Mignon.clyburn@fcc.gov 

Mike.O'Rielly@fcc.gov",https://www.reddit.com/r/malaysia/comments/7enkwk,2017-11-22 14:44:15,2021-04-2316:01:32
efe282,"Use resist bot on cell phone.It will send your text messages as faxes to senators / representatives. Just type 'resist' to 50409 and follow instructions. Yes, that easy!#resist #resistbot
",https://www.reddit.com/r/malaysia/comments/7enkwk,2017-11-22 14:39:03,2021-04-2316:01:32
D3M0NSLAY3R10,"Even though it sucks that the FCC is trying to take away net neutrality, it is awesome how the internet has come together to stop this problem.",https://www.reddit.com/r/malaysia/comments/7enkwk,2017-11-22 14:44:23,2021-04-2316:01:32
,"In order to save the internet, one of these 3 men have to change their mind and vote in favor of net neutrality. Tweet at them directly and let them know what you think:
https://twitter.com/AjitPaiFCC
https://twitter.com/BrendanCarrFCC
https://twitter.com/mikeofcc
Not many people have tweeted at them from what I can see, this might be the best way to make your voice heard.
Also:
https://www.fcc.gov/about/leadership Their individual contact information can be found under ""Bio"".
The three men plan to vote to repeal net neutrality. The two women plan to vote to keep net neutrality.
To defeat the net neutrality repeal, one of those three men has to change their vote. Pass it on!",https://www.reddit.com/r/malaysia/comments/7enkwk,2017-11-22 15:49:09,2021-04-2316:01:32
kaihiggins,I don’t know if this has been shared but there’s a White House petition! https://petitions.whitehouse.gov/petition/do-not-repeal-net-neutrality WE CAN DO THIS!,https://www.reddit.com/r/malaysia/comments/7enkwk,2017-11-22 16:37:20,2021-04-2316:01:32
knvngy,This pro net neutrality spam is everywhere. Corporate bots and minions  at full throttle ,https://www.reddit.com/r/malaysia/comments/7enkwk,2017-11-22 23:31:31,2021-04-2316:01:32
,"Honestly though, we can link this to 6 degrees of separation to Kevin Bacon. I'll start, Net Neutrality being in danger is because of the success of microtransactions in EA games",https://www.reddit.com/r/malaysia/comments/7enkwk,2017-11-22 14:46:48,2021-04-2316:01:32
ReticentVent,"https://www.reddit.com/r/KeepOurNetFree/comments/7elbs5/guys_net_neutrality_is_important/dq6fvt2



>In order to save the internet, one of these 3 men have to change their mind and vote in favor of net neutrality. Tweet at them directly and let them know what you think:

>https://twitter.com/AjitPaiFCC

>https://twitter.com/BrendanCarrFCC

>https://twitter.com/mikeofcc

>Not many people have tweeted at them from what I can see, this might be the best way to make your voice heard.
",https://www.reddit.com/r/malaysia/comments/7enkwk,2017-11-22 14:59:13,2021-04-2316:01:32
Itshammertimebitch,"[Net Neutrality post on r/roosterteeth] (https://www.reddit.com/r/roosterteeth/comments/7ejhnq/us_rooster_teeth_fans_your_ability_to_watch_their/)

If you're in the US, it's important that you understand how the vote on December 14th is going to work. Look at [this](https://www.reddit.com/r/television/comments/7ekrpi/the_fcc_just_announced_its_plan_to_slash_net/dq5pzj5/) comment 

> FYI - Congress and the Senate have nothing to do with this. Only five people at the FCC get to vote.

>[Here they are](https://www.fcc.gov/about/leadership). The three men plan to vote to repeal net neutrality. The two women plan to vote to keep net neutrality.

>Their individual contact information can be found under ""Bio"".

>To defeat the net neutrality repeal, one of those three men has to change their vote.
 
I’m not taking credit for this just sharing the info.",https://www.reddit.com/r/malaysia/comments/7enkwk,2017-11-22 15:13:12,2021-04-2316:01:32
alethu88,"Hey all Europeans. Let’s chip in to save the internet. Even though we’re not Americans, this is what we can do to help! Even though it won’t directly bother us, it will most probably open doors for governments in Europe to follow in their footsteps. 

If you want a neutral internet, please sign these petitions and close the doors to a controlled internet:

https://www.change.org/p/save-net-neutrality-netneutrality

https://www.savetheinternet.com/sti-home",https://www.reddit.com/r/malaysia/comments/7enkwk,2017-11-22 21:17:54,2021-04-2316:01:32
Shryke_777,"TO ANYONE WHO IS DOUBTING THIS FAKE REDDIT INITIATIVE TO ""RESIST"" THE FCC
YOU ARE CORRECT IN YOUR DOUBTS
REDDIT IS UNDER ATTACK AN ARMY OF SHILLS PAID BY
***GEORGE SOROS***
WE KNOW WHAT YOU ARE UP TO
THIS IS A COMPLETELY FABRICATED MASS HYSTERIA WITH MILLIONS OF FAKE REDDIT BOTS PROVIDING DOWNVOTES AND SPAMMING THE SAME TOPIC SO IT WILL FLOAT TO THE TOP
IT IS SO NAKEDLY OBVIOUS
I SUPPORT THE REPEAL OF THE NET NEUTRALITY ACT
AND YOU SHOULD TOO!
RESTORE INTEGRITY
CLEAN UP THE INTERNET
DON'T FALL FOR MANUFACTURED INTERNET CONTROVERSY

***THE INTERNET WILL BE FINE***
***GET OFF THE COMPUTER AND GO LIVE YOUR LIFE***


*****DON'T.BE.A.LEMMING*****",https://www.reddit.com/r/malaysia/comments/7enkwk,2017-11-22 15:21:36,2021-04-2316:01:32
,"Net neutrality is a moronic idea, it flies in the face of basic Quality of Service principles. You don’t want all traffic treated equally. Some content such as VoIP, streaming, and gaming needs low latency and that means prioritizing it over other content. 

Just remove the regional telecom monopolies and let competitors enter the market. Net neutrality has nothing to do with the problems in the market.",https://www.reddit.com/r/malaysia/comments/7enkwk,2017-11-22 11:26:15,2021-04-2316:01:32
fsirddd,"Why should we rely on commercial corporations for internet access anymore after this?

Our  response should be to demand and petition the FEDERAL government to step in and build a free public internet!

For the money we pay the internet providers we should have the internet we want.

If they won't provide it we need to take that money back from the isp's in taxes to fund and build a government maintained alternative free public internet. 

Now is the perfect time to push for something like this and strike while the iron and tempers are hot!

There's no reason to rely on or trust these commercial entities with our digital communications any longer.
",https://www.reddit.com/r/malaysia/comments/7enkwk,2017-11-22 14:39:01,2021-04-2316:01:32
,[removed],https://www.reddit.com/r/malaysia/comments/7enkwk,2017-11-22 13:49:53,2021-04-2316:01:32
songofsixpence,"When I see this ""red flag"" this is a cue to do exactly the opposite. Want to go against the proverbial man? NN is not what it seems.",https://www.reddit.com/r/malaysia/comments/7enkwk,2017-11-22 14:06:22,2021-04-2316:01:32
mynamejeoff,"I wish I was able to blend in with the FCC crowd at whatever speech he will give, infiltrate it, and slap him in the face with a shoe, then gouge his eyes out",https://www.reddit.com/r/malaysia/comments/7enkwk,2017-11-22 17:29:24,2021-04-2316:01:32
ruralexcursion,GO REDDIT GO!!!!!,https://www.reddit.com/r/malaysia/comments/7enkwk,2017-11-22 14:08:00,2021-04-2316:01:32
httpsgooglqNJk1,"good stuff man
",https://www.reddit.com/r/malaysia/comments/7enkwk,2017-11-22 14:49:03,2021-04-2316:01:32
smokeygreen420,Land of the free.... ,https://www.reddit.com/r/malaysia/comments/7enkwk,2017-11-22 14:49:49,2021-04-2316:01:32
Baddaboombaddabing,Ajit has wares if you have coin...,https://www.reddit.com/r/malaysia/comments/7enkwk,2017-11-22 15:08:14,2021-04-2316:01:32
DigletDigler,"So if you haven't already, there's a bot you can text, that helps you write an email or a fax, free of charge, to your senator, or governor. Text ""resist"" to ""504-09"" and it'll ask you some questions, then you're onto writing. From another thread a few weeks ago, someone posted this message, and it think it's a great one to send.

""Net Neutrality is the cornerstone of innovation, free speech and democracy on the Internet.

Control over the Internet should remain in the hands of the people who use it every day. The ability to share information without impediment is critical to the progression of technology, science, small business, and culture.

Please stand with the public by protecting Net Neutrality once and for all.""

I'd love to credit the user, but have lost the comment, but please, go send some faxes, show your politicians you want net neutrality to stay.",https://www.reddit.com/r/malaysia/comments/7enkwk,2017-11-22 15:12:44,2021-04-2316:01:32
,"In the past, I was very vocal about net neutrality but a lot's changed
politically since now & then that makes me think that regardless
of who gets their way & the outcome, this is a very bad time
for anyone to take a reactionary position considering the series of
L's the left has racked up.  Before these regulations were put
in place, all of these nightmare scenarios largely rested upon
corporations buying policy that makes things worse & ISP's
illegally colluding to agree not to compete when it comes to
extorting users into paying for tiered service.
Obviously there's less nightmarish anti-competative actions
that we've already seen happen in the past like slowing down
Netflix but I can't help but feel like Net Neutrality riling people
up every year or 2 could be used as a psychological tactic
that brings people together across party lines in fear of losing
a part of life that we take for granted.  A subconscious reality
check like that is definitely a good idea & without sounding like
I'm making a Thanksgiving pun, right now is a great time to
attempt a little reset like that on our collective political conscience.


And as a side note, I found it interesting that the increased news
coverage suddenly had my parents both asking me what exactly
""net neutrality"" means since they remember me talking about
it years ago.  It's not every day that I get to explain something
complicated without quickly getting a ""Never mind, I'm too dumb
for this"" or ""Since I can't defend my pre-programming in this
discussion, I'm just going to shut the discussion down by slinging
bullshit in all directions until you fatigue & walk away"".",https://www.reddit.com/r/malaysia/comments/7enkwk,2017-11-22 15:19:48,2021-04-2316:01:32
m1ksuFI,Why should freak out about net neutraloty? I live in Europe.,https://www.reddit.com/r/malaysia/comments/7enkwk,2017-11-22 15:26:35,2021-04-2316:01:32
oddshouten,Your*,https://www.reddit.com/r/malaysia/comments/7enkwk,2017-11-22 15:31:26,2021-04-2316:01:32
Rvmntrx,#TOTALLY GRASSROOTS ,https://www.reddit.com/r/malaysia/comments/7enkwk,2017-11-22 15:52:51,2021-04-2316:01:32
Llama_Juice,"Is there anything we can do to help, even if we don’t live in the US? ",https://www.reddit.com/r/malaysia/comments/7enkwk,2017-11-22 16:29:25,2021-04-2316:01:32
juniperjumpercables,"For all non Americans who want to help I’ve been directed to this URL: 

https://petitions.whitehouse.gov/petition/replace-ajit-pai-fcc-restore-net-neutrality-make-last-mile-networking-public-utility-and-stop-corporate-abuse-0

Remember to confirm your signature and let’s try and get this shit sorted ",https://www.reddit.com/r/malaysia/comments/7enkwk,2017-11-22 17:07:56,2021-04-2316:01:32
PrimarisMarine,"In the apple sub LOL.
Apple would love to pay you extra to use their shit.

OH WAIT you already do..",https://www.reddit.com/r/malaysia/comments/7enkwk,2017-11-22 18:45:46,2021-04-2316:01:32
tmcgee2481,"Never forget what it could all become: 

https://i.imgur.com/2OFtIcx.jpg",https://www.reddit.com/r/malaysia/comments/7enkwk,2017-11-22 20:10:53,2021-04-2316:01:32
MkMouze,Quick site to visit: https://petitions.whitehouse.gov/petition/do-not-repeal-net-neutrality,https://www.reddit.com/r/malaysia/comments/7enkwk,2017-11-23 01:41:03,2021-04-2316:01:32
,"An APPLE sub getting upset at the idea of a free market. Oh, the absolute irony. 

edit: Upvotes or downvotes will not change the truth.",https://www.reddit.com/r/malaysia/comments/7enkwk,2017-11-22 11:46:40,2021-04-2316:01:32
thailoblue,Doesn’t relate to Apple. Go ship in your own sub.,https://www.reddit.com/r/malaysia/comments/7enkwk,2017-11-22 12:22:14,2021-04-2316:01:32
neazmoh,I don’t get it u guys vote for these govt. reap what u sow,https://www.reddit.com/r/malaysia/comments/7enkwk,2017-11-22 15:06:34,2021-04-2316:01:32
Fullback520,"WE CAN STILL FIGHT!! White house petition for Net Neutrality!!!

https://petitions.whitehouse.gov/petition/do-not-repeal-net-neutrality",https://www.reddit.com/r/malaysia/comments/7enkwk,2017-11-22 15:09:04,2021-04-2316:01:32
cis_white_guy,Here is a White House petition to [save Net Neutrality.](https://petitions.whitehouse.gov/petition/do-not-repeal-net-neutrality),https://www.reddit.com/r/malaysia/comments/7enkwk,2017-11-22 15:29:05,2021-04-2316:01:32
shabbaranksx,Everybody has this preconceived notion that the internet providers will have a tiered subscription... what if they don’t?,https://www.reddit.com/r/malaysia/comments/7enkwk,2017-11-22 13:38:19,2021-04-2316:01:32
panditmurari,"Love problam solution astrologer in India so call me now +91-9352436734
",https://www.reddit.com/r/malaysia/comments/7enkwk,2017-11-22 14:46:55,2021-04-2316:01:32
Frodo73,"Sign the White House petition if you care about Net Neutrality. 

https://petitions.whitehouse.gov/petition/do-not-repeal-net-neutrality",https://www.reddit.com/r/malaysia/comments/7enkwk,2017-11-22 21:05:49,2021-04-2316:01:32
knvngy,"Please people , report this kind of  spam.",https://www.reddit.com/r/malaysia/comments/7enkwk,2017-11-22 23:31:52,2021-04-2316:01:32
,plz no more,https://www.reddit.com/r/malaysia/comments/7enkwk,2017-11-22 14:23:13,2021-04-2316:01:32
jones_ok,Reported. Spam.,https://www.reddit.com/r/malaysia/comments/7enkwk,2017-11-22 13:44:08,2021-04-2316:01:32
KZedUK,"""There's plenty of chargers in the world""

""We're including a USB C to Lightning cable in the box, so it doesn't work with your existing chargers""",https://www.reddit.com/r/malaysia/comments/jaidc5,2020-10-14 01:47:01,2021-04-2316:01:32
baconator41,"Cord is lightning too usb c, a charging brick I would argue most people don't have.",https://www.reddit.com/r/malaysia/comments/jaidc5,2020-10-14 01:43:11,2021-04-2316:01:32
Sirerdrick64,"Serious question...since the phone still has a lightning port, could we not just ignore the new cable, and use our existing iPad / iPhone charger blocks?",https://www.reddit.com/r/malaysia/comments/jaidc5,2020-10-14 02:27:55,2021-04-2316:01:32
-Phinocio,"This would make more sense if they didn't also change the cable that comes in the box.. 

I'm sure people upgrading iPhones can just use their old adapter and cable to charge... but then it's also just a waste of a cable. I'm certain that while there's billions of adapters in the wild already...a very very very small amount are USB-C which would leave a lot of people needing to buy an adapter anyway.",https://www.reddit.com/r/malaysia/comments/jaidc5,2020-10-14 01:55:48,2021-04-2316:01:32
Kkvle,Anker gang.,https://www.reddit.com/r/malaysia/comments/jaidc5,2020-10-14 03:28:41,2021-04-2316:01:32
mushiexl,"I should be able to get them for free if I ask for it. If not, then they're just doing it for the money.

**alright I know thats typical apple, damn**",https://www.reddit.com/r/malaysia/comments/jaidc5,2020-10-14 01:45:19,2021-04-2316:01:32
Ohmm,"I think the issue is that the box comes with a USB-C cable. Yes, there are 2 billion power adapters out there, but an overwhelming majority are USB-A cables. Plenty of people are going to get this phone and won’t be able to change it lol",https://www.reddit.com/r/malaysia/comments/jaidc5,2020-10-14 01:44:51,2021-04-2316:01:32
hmd53,Why didn’t they go for usb c in their pro lineup like they did with the iPad Air?,https://www.reddit.com/r/malaysia/comments/jaidc5,2020-10-14 02:24:18,2021-04-2316:01:32
afinita,"So less materials and less shipping costs.  Same price.

Apple, so visionary.",https://www.reddit.com/r/malaysia/comments/jaidc5,2020-10-14 01:46:50,2021-04-2316:01:32
PhilsterM9,Android users have free reign to shit on apple for this tbh,https://www.reddit.com/r/malaysia/comments/jaidc5,2020-10-14 01:43:05,2021-04-2316:01:32
webstavros,Does it even come with a phone?,https://www.reddit.com/r/malaysia/comments/jaidc5,2020-10-14 03:14:44,2021-04-2316:01:32
,[deleted],https://www.reddit.com/r/malaysia/comments/jaidc5,2020-10-14 03:09:47,2021-04-2316:01:32
-xstatic-,Every phone and tablet manufactured in 2020 should come with USB-C ports as standard.   Enough of this proprietary bullshit.  Make it all universal.,https://www.reddit.com/r/malaysia/comments/jaidc5,2020-10-14 03:26:08,2021-04-2316:01:32
yupyupyupyupyupy,">	This move will have environmental benefits but the company will draw criticism for penny-pinching customers.

this is effing awful",https://www.reddit.com/r/malaysia/comments/jaidc5,2020-10-14 01:54:48,2021-04-2316:01:32
thenerdal,"I started supporting this if the cable in the box was a USB-A cable, but it's USB-C...what the fuck, those are even less common..",https://www.reddit.com/r/malaysia/comments/jaidc5,2020-10-14 01:43:34,2021-04-2316:01:32
battlerumdam,I actually laughed because of their explanation. It won’t decrease their carbon footprint when I need to buy a charger and headphones as a first time apple user.,https://www.reddit.com/r/malaysia/comments/jaidc5,2020-10-14 01:45:11,2021-04-2316:01:32
ILikeSugarCookies,So stupid doing it on the first transition to a usb-c to lightning charging cable. *Nobody* has a USB-C brick.,https://www.reddit.com/r/malaysia/comments/jaidc5,2020-10-14 01:43:46,2021-04-2316:01:32
derob_,"If this was for environmental reasons, I should be able to go to an Apple Store and receive one for free with proof of purchase of the iPhone. But obviously that's not going to happen because it's not for environmental reasons and anyone who believes that is an idiot.",https://www.reddit.com/r/malaysia/comments/jaidc5,2020-10-14 02:07:10,2021-04-2316:01:32
,[deleted],https://www.reddit.com/r/malaysia/comments/jaidc5,2020-10-14 04:18:41,2021-04-2316:01:32
boardinmpls,Everyone will copy this in a year.,https://www.reddit.com/r/malaysia/comments/jaidc5,2020-10-14 05:05:52,2021-04-2316:01:32
mrsparil,The amount of turd polishing in their video was cringe-worthy.,https://www.reddit.com/r/malaysia/comments/jaidc5,2020-10-14 01:43:51,2021-04-2316:01:32
pr0sp3k,What do yall mean for the sake of the enviroment?! They decided that just because they can. Just because yall keep buying no matter what.,https://www.reddit.com/r/malaysia/comments/jaidc5,2020-10-14 03:18:45,2021-04-2316:01:32
Ricky_RZ,"They are right that I have a load of bricks at home.

But all of them are USB-A, not USB-C",https://www.reddit.com/r/malaysia/comments/jaidc5,2020-10-14 03:09:26,2021-04-2316:01:32
TheLookoutGrey,I’ve never even seen a USB-C brick,https://www.reddit.com/r/malaysia/comments/jaidc5,2020-10-14 02:20:11,2021-04-2316:01:32
adrinosaure,"It’s important to note that because of EU regulations, earbuds are still in the box in Europe",https://www.reddit.com/r/malaysia/comments/jaidc5,2020-10-14 05:17:59,2021-04-2316:01:32
rr90013,I’m actually pretty frustrated by the lack of free EarPods.,https://www.reddit.com/r/malaysia/comments/jaidc5,2020-10-14 11:07:32,2021-04-2316:01:32
cohrt,a $1k phone and it doesn't even come with a fucking charger?,https://www.reddit.com/r/malaysia/comments/jaidc5,2020-10-14 03:43:12,2021-04-2316:01:32
HairWeaveKillers,Lol why a usb c to lightning port. It would’ve made more sense if it was usb a to lightning port,https://www.reddit.com/r/malaysia/comments/jaidc5,2020-10-14 01:47:38,2021-04-2316:01:32
heyDuu95,Does it come with the cable at least?,https://www.reddit.com/r/malaysia/comments/jaidc5,2020-10-14 02:15:16,2021-04-2316:01:32
cushting,"absolute jokers lol, they just made those 2 billion charger plugs obsolete by changing to usb-c and now 99% of people who buy an iphone will have to buy a new plug seperately loll",https://www.reddit.com/r/malaysia/comments/jaidc5,2020-10-14 01:44:12,2021-04-2316:01:32
4Dolla76,Apple is the world's best/most accepted scam,https://www.reddit.com/r/malaysia/comments/jaidc5,2020-10-14 10:10:35,2021-04-2316:01:32
CedTruz,"So they are not including them with the iPhone, to save on the size of the phone box, but are still selling them separately... in their own boxes?",https://www.reddit.com/r/malaysia/comments/jaidc5,2020-10-14 05:11:21,2021-04-2316:01:32
IversonsWorkEthic,There will be more waste since you then also have to order a charger and adapter?,https://www.reddit.com/r/malaysia/comments/jaidc5,2020-10-14 01:43:09,2021-04-2316:01:32
MortalPhantom,"I was thinking on getting an iphone. But if I did I literally wouldn't be able to charge it. I don't have any USB C port. The only ones I have is for my android phones but that's USB A to C.

Do compared to last year I would need to pay 100 dollars more AND a charger and headphones?

That sucks. And if you're buying the ""doing it for the envoirment"" thing you're naive as a five years old.",https://www.reddit.com/r/malaysia/comments/jaidc5,2020-10-14 23:27:24,2021-04-2316:01:32
dotcomslashwhatever,CoUrAgE,https://www.reddit.com/r/malaysia/comments/jaidc5,2020-10-14 03:41:07,2021-04-2316:01:32
,[deleted],https://www.reddit.com/r/malaysia/comments/jaidc5,2020-10-14 02:19:56,2021-04-2316:01:32
ajnails,"Kinda on a similar note- we finally saw the future of the port-less iPhone: MASAFE. In 3-4 years I think it would be dope when everyone has a Magsafe charger in homes, coffee shops, planes, etc.",https://www.reddit.com/r/malaysia/comments/jaidc5,2020-10-14 02:16:51,2021-04-2316:01:32
ChemicalDaniel,"“There are 2 billion power adapters in the world”

Ok fair enough. Now subtract the amount of people that bought an iPhone 11 Pro Max. That number is *the number of power adapters that won’t be compatible with the same shitty cable you’re shipping*.

They didn’t even braid the cable like the leaks said. Had they gone with a USB-A cable their point would’ve been more sound. All you’re doing now is making the hundreds of millions of people who don’t own a USB-C charging brick (I literally didn’t own one until a few days ago) buy a new one. So yeah the shipping emissions and shit won’t be on your head, it will be on Amazon’s. And worst of all they’re gonna throw away their perfectly working old power adapters, causing even more damage to the environment...",https://www.reddit.com/r/malaysia/comments/jaidc5,2020-10-14 03:05:48,2021-04-2316:01:32
ThaiJohnnyDepp,"Well I'm sure they'll pass the savings on to the consumer, right?

... right?!",https://www.reddit.com/r/malaysia/comments/jaidc5,2020-10-14 05:08:29,2021-04-2316:01:32
Nule89,They should just make an iPhone with a battery that lasts 8 months and can't be recharged,https://www.reddit.com/r/malaysia/comments/jaidc5,2020-10-14 04:52:56,2021-04-2316:01:32
redditbuddie,If Apple were *really* GreenApples then they would allow customers to trade in their old USB-A's for a replacement USB-C,https://www.reddit.com/r/malaysia/comments/jaidc5,2020-10-14 09:48:52,2021-04-2316:01:32
R4K1B-,Bruh. They increased the price by 100$ too,https://www.reddit.com/r/malaysia/comments/jaidc5,2020-10-14 01:51:11,2021-04-2316:01:32
Greasy_Goon,There are 2 billion charging bricks out there... so here’s a cable that doesn’t fucking work with any of them,https://www.reddit.com/r/malaysia/comments/jaidc5,2020-10-14 03:16:41,2021-04-2316:01:32
,[deleted],https://www.reddit.com/r/malaysia/comments/jaidc5,2020-10-14 03:32:37,2021-04-2316:01:32
AssaultLemming,Honestly apple customers by this point are the dumbest people in the world.,https://www.reddit.com/r/malaysia/comments/jaidc5,2020-10-14 16:10:03,2021-04-2316:01:32
TheEliteCalhoun,"As a Duo owner, not sure how to comment.  My phone came with a free case, but has a potato cam. 😂",https://www.reddit.com/r/malaysia/comments/jaidc5,2020-10-14 04:08:31,2021-04-2316:01:32
PrometheusTitan,"Interestingly, ***all*** the iPhone models now on sale (iPhone 12, 11, Xs/Xr and SE) all come without chargers or headphones. See [the iPhone 11 page](https://www.apple.com/uk/shop/buy-iphone/iphone-11) as an example.

**CLARIFICATION:** I didn't mean to say the XR, XS and 11 models *never* came with headphones & charger. I'm saying Apple has updated their current stock (which they sell as last-year and two-year-old models for lower prices) and those models now and going forward don't include headphones or chargers, but do include the USB-C to Lightning cable",https://www.reddit.com/r/malaysia/comments/jaidc5,2020-10-14 04:59:09,2021-04-2316:01:32
demonovation,"""But I don't have a USB C charging brick!"" 

Me: *laughs in Samsung*",https://www.reddit.com/r/malaysia/comments/jaidc5,2020-10-14 05:15:30,2021-04-2316:01:32
mrjohnhung,"Thank you apple for removing fast chargers and headphones, boy I sure love the environment.",https://www.reddit.com/r/malaysia/comments/jaidc5,2020-10-14 02:08:03,2021-04-2316:01:32
Cedrius,"hahahahahahaha, imagine buying a fucking phone without having a charger included. Steve Jobs is turning in his grave.",https://www.reddit.com/r/malaysia/comments/jaidc5,2020-10-14 02:58:50,2021-04-2316:01:32
metheetio,Hopefully iPhone 13 wont come with a phone at all,https://www.reddit.com/r/malaysia/comments/jaidc5,2020-10-14 05:04:04,2021-04-2316:01:32
