author,comment,URL,Comment Time,Crawl Time
silentq15,"It sounds like now Google has removed Fortnite.  I personally feel Epic out of their wheelhouse here.  The way I have looked at platform holders rules is that it’s really up to them to set the rules within reason.  As far as the 30% well if you don’t want to give Apple the 30% then leave the platform.

Apple provides Hardware and a means of Software Distribution that makes it easy for both the user and developers to get there Apps out to the public and make money.

If Epic has an issue with it then I welcome them to produce their own phones and manage their own store and build it up.  They definitely aren’t short on the money to do it.

To expect Platform Holders like Google and Apple to not take their cut because Epic thinks there video game is bigger than the entire ecosystem is just absurd.  These rules and agreements are made when the devs sign the terms of service.  Sorry I know it’s not the popular opinion but it is what it is.",https://www.reddit.com/r/malaysia/comments/i95vei,2020-08-14 11:07:00,2021-04-2316:01:32
SilverSovereign,"I see a company going rogue and breaking a service agreement and store policy.  When that happens you get kicked, no matter how big you are.",https://www.reddit.com/r/malaysia/comments/i95vei,2020-08-14 06:11:05,2021-04-2316:01:32
CleverBandName,This is fucking stupid. Epic wants to use Apple’s platform without paying for it. All the anti-trust talk is just cover.,https://www.reddit.com/r/malaysia/comments/i95vei,2020-08-14 11:52:40,2021-04-2316:01:32
m_de41,"To be completely honest here, it seems that many people are unaware of the way App Store profit cuts work and think it is just Apple ""abusing power."" As someone who develops apps for iOS, I personally think that the 30% cut that everybody is talking about is reasonable. Apple is actually generous with their platform, providing developers with the opportunity to seamlessly distribute their apps/games to users and ensure the consumers they are getting a secure product. The ideology behind the App Store is enough to make Apple big enough to take this 30% cut.

Others have been comparing this lawsuit to Netflix and Spotify for example, but these payment methods (sending the user to purchase a subscription in a browser) are not what Epic Games was attempting. Netflix and Spotify's methods are not encouraged by Apple, but are not so obvious that they would encourage a lawsuit over it. Epic Games is trying Apple by breaking the rules, which are very clear, and most of them can be found [here](https://developer.apple.com/app-store/review/guidelines/). Every developer follows these and doesn't whine about them. It is just part of developing for iOS.

And I am almost sure for this case, Apple will be seen as more lawful here, because they set rules which are to be followed, and there is nothing Apple protects more than the App Store. And another thing to remember: while Epic Games has planned this out (it's obvious), Apple has fought this fight for years, and they are very prepared as well.",https://www.reddit.com/r/malaysia/comments/i95vei,2020-08-14 05:46:14,2021-04-2316:01:32
bananamadafaka,Hahahahahaha I love this shit.,https://www.reddit.com/r/malaysia/comments/i95vei,2020-08-14 03:11:38,2021-04-2316:01:32
Fizzster,"I, for one, applaud Apple for doing exactly what they should have done.

I purchased an iPhone for many reasons, but one of them is the closed ecosystem, and the extra privacy/security that affords me.  When an app attempts to circumvent that ecosystem, I would be upset if Apple DIDN'T remove it.

If you want third party app stores and multiple payment processors handling your personal information, Android is over there, and they're doing fine. 

The fact that Fortnite will continue to have millions of players even after dropping iOS support only hurts their argument that Apple is a monopoly.",https://www.reddit.com/r/malaysia/comments/i95vei,2020-08-14 05:45:40,2021-04-2316:01:32
sonicmario123,"This may be an unpopular opinion but I’m siding with Apple. Epic did violate a very clearly stated policy. Their argument of it being unfair and Target analogy makes no sense when it applied to the iPhone ecosystem. Apple is moving towards a very strict and very needed pro consumer privacy policy as evident with the additions of iOS 14. They shouldn’t be required or even need to allow a 3rd party App Store because they have to protect the security of people’s phones, and with a third party App Store there is no way for Apple to 100% guarantee the security and safety of a person’s info since they would have no vetting power over the apps on a 3rd party store. Yeah the 30% fee may be a lot but honestly Epic can afford it, they make enough money on young, dumb and impressionable kids spending parents money anyways.",https://www.reddit.com/r/malaysia/comments/i95vei,2020-08-14 05:40:12,2021-04-2316:01:32
SamSparkSLD,"So epic games made a ton of money on the App Store and now they want the whole pie not just 70%? From what I’m reading it says Epic agreed to the deal, that is also applied to every developer equally, but then purposefully updated the game to break the rules and try to take a bigger cut. In my opinion, Epic Games is pushing for more money while masking behind being anti-monopoly",https://www.reddit.com/r/malaysia/comments/i95vei,2020-08-14 13:22:12,2021-04-2316:01:32
PabloEscobar_49,"A few tech giants battle each other in court, the only real loser here is the consumer.
They are not fighting for the small devs on the appstore either, its simply just a battle on who is getting what % of revenue. There won't be any downward price adjustments. 

I just don't want to install a second, third, fourth Store on my Phone. 
Also I don't really like giving every Publisher out there my payment information,because if epic is doing it, others will follow. 

I don't know the revenue of Fortnite on mobile, but I guess they don't want the app be gone for long.",https://www.reddit.com/r/malaysia/comments/i95vei,2020-08-14 16:30:03,2021-04-2316:01:32
Model_Mania,Good,https://www.reddit.com/r/malaysia/comments/i95vei,2020-08-14 19:19:47,2021-04-2316:01:32
TheSeanis,"It's not some altruistic mission. They want as big of a cut as they possibly can get, on a virtual currency nonetheless. Literally exchange your real dollars for worthless things that you can't even re-sell. Yes, most game producers or app devs will have to account for Apples 30% cut, but, it is what it is. They made the platform and the market.",https://www.reddit.com/r/malaysia/comments/i95vei,2020-08-14 03:14:37,2021-04-2316:01:32
,"Glad to see Apple sticking to their guns here. Glad to see giant developers aren’t exempt from playing by the rules. We can disagree about these rules, but I’m glad it’s universal.",https://www.reddit.com/r/malaysia/comments/i95vei,2020-08-14 05:12:05,2021-04-2316:01:32
Temmery,Fornite deliberated broke some Apple store rules to start this war. Now playing the victim? With a media campaign ready in a few hours? Hilarious,https://www.reddit.com/r/malaysia/comments/i95vei,2020-08-14 05:02:24,2021-04-2316:01:32
drewkk,"Fortnite made Epic $1.8 BILLION, yeah no sympathy from me.

Just another greedy corporation, no different to Apple and Google in that regard.",https://www.reddit.com/r/malaysia/comments/i95vei,2020-08-14 08:43:00,2021-04-2316:01:32
DirkEnglish,"The OFFICIAL Fortnite twitter is comparing this to 1984. They said something like, ""dont let 2020 be 1984. Sign the petition to bring fortnite back now"" - And that shit made my fucking brain melt",https://www.reddit.com/r/malaysia/comments/i95vei,2020-08-14 08:27:34,2021-04-2316:01:32
shiggity-shwa,"My question is if Apple will counter sue over the blatant violation of the TOS. It was a direct link to a competing store for users to enter and use payment details, INSIDE THE APP. How many parents are going to find charges on their statements this month? It was a malicious and nefarious attempt to circumvent the company that hosts their files and updates. Does Epic want free use of Apple’s servers at no charge? If their argument is “Apple is a big company and they can afford it” then Epic should look in the mirror. $20 for a skin that’s only available for a brief amount of time? And oh, I have a few extra V Bucks left over, but not enough to buy anything. Better buy more V Bucks! I’m glad they dropped loot boxes (reluctantly, after the governments of the world pressured the industry) but their store front is still pretty damned shifty. If they can’t abuse people’s urges to gamble, then they’ll abuse the FOMO of those same weak willed individuals. 

This is just a big company trying to save/make more money. Don’t fall for their BS about this being some “for the people” altruistic cause. The fact they had their smear campaign at the ready is proof they did this on purpose, and goaded Apple into a battle by manipulating their (largely young) player base. 

Apple takes a similar cut as other companies. Should we sue Microsoft for taking a cut of every Windows PC? Valve for taking a cut? Sony? Google? How about Best Buy? They take a cut of everything sold in their store. That causes prices to be more expensive than wholesale. They’re profiting off the products they sell, even though they did not make them. Isn’t that unfair?

No, because we can buy stuff from another store. We can also buy Fortnite from other suppliers for other devices. We don’t HAVE to buy Apple products. Same principal.",https://www.reddit.com/r/malaysia/comments/i95vei,2020-08-14 09:45:04,2021-04-2316:01:32
-PineapplePancakes-,"Isn't that how it works? Apple provides the developer a platform, and the developer has to pay Apple a fee? Am I wrong?",https://www.reddit.com/r/malaysia/comments/i95vei,2020-08-14 20:27:56,2021-04-2316:01:32
bibbidybum,Can’t wait for the fortnite phone,https://www.reddit.com/r/malaysia/comments/i95vei,2020-08-15 04:36:15,2021-04-2316:01:32
BiteofAAPL,"Does the App Store need to evolve? Yes. This though, is theatrics. 

What did they think would happen? They failed to follow the App Store guidelines as they currently are set. They want them changed? That’s what is taking place with investigations/complaints in the U.S. and the EU. 

Apple isn’t going to willingly change their guidelines. They will be forced to. The changes won’t happen this year or next. It will be tied up with rulings, appeals, etc for years to come.",https://www.reddit.com/r/malaysia/comments/i95vei,2020-08-14 03:03:42,2021-04-2316:01:32
Can_of_Ubik,"I'd rather see Google and Apple succeed, as cancerous as they may be, than a disgusting Tencent's puppet.",https://www.reddit.com/r/malaysia/comments/i95vei,2020-08-14 09:34:25,2021-04-2316:01:32
HongRiki,I mean it’s like leasing a building and not paying rent.,https://www.reddit.com/r/malaysia/comments/i95vei,2020-08-14 12:32:22,2021-04-2316:01:32
iComputerGeek101,"I don’t agree with Apple on the Microsoft thing, but I agree with Apple on this one. Fortnite obviously knew this was against the rules. What did they think was gonna happen?!?",https://www.reddit.com/r/malaysia/comments/i95vei,2020-08-14 03:09:08,2021-04-2316:01:32
leo300199,Finally some good news in 2020,https://www.reddit.com/r/malaysia/comments/i95vei,2020-08-14 05:46:19,2021-04-2316:01:32
,[deleted],https://www.reddit.com/r/malaysia/comments/i95vei,2020-08-14 09:34:56,2021-04-2316:01:32
TheMadolche,Don't forget that epic is shill company. They are 40% owned by tencent and have their terrible game store which is just as bad as they claim about Apple.,https://www.reddit.com/r/malaysia/comments/i95vei,2020-08-14 13:07:01,2021-04-2316:01:32
Premier_Legacy,Hope Apple wins and literally ignores them,https://www.reddit.com/r/malaysia/comments/i95vei,2020-08-14 05:33:06,2021-04-2316:01:32
,How dare apple and google take a cut for something sold on their store right,https://www.reddit.com/r/malaysia/comments/i95vei,2020-08-14 12:15:29,2021-04-2316:01:32
SimonR2905,"Hear me out:

Epic had this whole thing planned out for a big publicity stunt trying to paint themselves as the selfless hero and Apple as the villain. That is not the case.

Epic deliberately broke a rule that will lead to removal from the Apple App Store & Google Play Store which makes the game unavailable to billions of users. They knew this was gonna happen.

They always had the same prices ($10 for 1000V-Bucks) on all devices wether they had to give 30% away or not. Again, this is a publicity stunt nothing more.

Apple also owns the App Store and promoted Fortnite multiple times and they make it easily accessible to billions of potential players, most of whom would be spending money on V Bucks eventually. The App Store needs to create revenue just like the Google Play Store because servers and server rooms cost money.

This is a petty campaign that denied hundreds of millions of players the access to Fortnite for some good press and a legal battle against Apple which they’re probably gonna lose.",https://www.reddit.com/r/malaysia/comments/i95vei,2020-08-14 09:15:56,2021-04-2316:01:32
Silvedoge,"And now they're playing a [short](https://twitter.com/FortniteGame/status/1293984290326433792?s=19) that seems specifically aimed at apple. Kind of shouting at a brick wall here, I highly doubt apple cares.",https://www.reddit.com/r/malaysia/comments/i95vei,2020-08-14 03:25:54,2021-04-2316:01:32
bh_44,"I can’t wait to have 4 different app stores, each with my payment details, each trying to push updates, just so that Epic, Microsoft... can make more money. That 30% cut isn’t going to end up in the consumers hands.",https://www.reddit.com/r/malaysia/comments/i95vei,2020-08-14 06:07:20,2021-04-2316:01:32
cardshark3740,Thank god. This trash heap of a game is finally off one platform,https://www.reddit.com/r/malaysia/comments/i95vei,2020-08-14 06:54:19,2021-04-2316:01:32
krins12,Okay but the 1984 Ad campaign is genius,https://www.reddit.com/r/malaysia/comments/i95vei,2020-08-14 08:12:48,2021-04-2316:01:32
TheGiant1989,"I get this is a marketing stunt, what I dont get is the insistence in breaking up Apples walled garden as it were. 

I buy Apple, among other reasons, specifically for that walled garden. I work all day with messy computers/IT",https://www.reddit.com/r/malaysia/comments/i95vei,2020-08-14 09:39:51,2021-04-2316:01:32
,It’s also removed from google for the same reason. They make too much money to fly under the radar with this. Apple and Google both want their cut.,https://www.reddit.com/r/malaysia/comments/i95vei,2020-08-14 09:44:59,2021-04-2316:01:32
ItsColvin,"I may be wrong here but.. Apple made their own devices and software, they should have the say of what/who is able to do what on **their** products/devices. 

If they say if someone wants to put an app on their devices, then they gotta follow the rules that Apple puts in place, especially if you make a profit from it because that profit is only available to that company by it being available on those devices. 

if im wrong please open a dialogue...",https://www.reddit.com/r/malaysia/comments/i95vei,2020-08-14 09:48:39,2021-04-2316:01:32
-Gwynbleidd,"There are two channels at play here. Yeah, undeniably apple could squash the company into the ground, as it could with pretty much any company that has an app in the App Store. But this isn’t a money issue, this is a trust issue. 
If apple allow people use their own payment methods then they do it for one they have to do it for all and then they can’t control it and if people start scamming people then it damages the apple brand not the random company. Company can shut down, change name and reopen a week later, apple cant do that. 

Fortnite see it as apple taking their money for their product which is fair enough, but 100% of the people playing fortnite care about fortnite. But a fraction of the apple user base cares about fortnite. Personally, I want to see companies grow from using apple and undoubtedly fortnite is making money from their program on the apple infrastructure but I personally own about friggin 8 apple products. In my office there is about 40 people who the large majority of them own apple products and no one plays fortnite. I like that apple has systems in place that protects me and so I give my information to them. If I was at a higher risk I would be less hesitant to give them my information, which then hurts the apple brand. 

I see both sides in this argument, and I would be disappointed if apple opened themselves up which I can’t see happening but hopefully they can agree on something middle ground.",https://www.reddit.com/r/malaysia/comments/i95vei,2020-08-14 10:11:13,2021-04-2316:01:32
wackykirby,They were also removed from the Google Play Store,https://www.reddit.com/r/malaysia/comments/i95vei,2020-08-14 11:04:12,2021-04-2316:01:32
hzfan,Call me a conspiracy nut but I feel like they’re doing this right now to draw attention away from the Fall Guys release and to remain relevant. It’s the only battle royale game in a very long time that’s had as much of a viral presence on release as Fortnite did.,https://www.reddit.com/r/malaysia/comments/i95vei,2020-08-14 11:37:02,2021-04-2316:01:32
sirseniorbablino,"""That case is more difficult to level against Google, which controls Android software less strictly than Apple does for iOS. Android has long allowed for the installation of third party app stores, including Epic’s own Epic Games App. Apps can also be sideloaded through direct links, without the involvement of an app store.""

Google does not have a monopoly then -> people just dont want to use the Epic shitty app.",https://www.reddit.com/r/malaysia/comments/i95vei,2020-08-14 12:00:33,2021-04-2316:01:32
Clarky1979,"Literally, in the literal sense, who cares?",https://www.reddit.com/r/malaysia/comments/i95vei,2020-08-14 12:01:09,2021-04-2316:01:32
RejZoR,"While it sucks that Apple enforces this, Epic damn well knew the rules and broke them. So, I’m not so sure who’s the idiot here.",https://www.reddit.com/r/malaysia/comments/i95vei,2020-08-14 12:04:02,2021-04-2316:01:32
benarmmy99,"I know this is supposed to be controversial or something, but thank god it’s gone",https://www.reddit.com/r/malaysia/comments/i95vei,2020-08-14 12:18:21,2021-04-2316:01:32
damon459,Google play followed suit and pulled the game for the same reason.,https://www.reddit.com/r/malaysia/comments/i95vei,2020-08-14 13:39:37,2021-04-2316:01:32
NorvilleRogers1969,"As in, fortnite implemented direct payments, by-passing Apple?",https://www.reddit.com/r/malaysia/comments/i95vei,2020-08-14 14:22:42,2021-04-2316:01:32
Generalrossa,There's going to be a lot of angry kids..,https://www.reddit.com/r/malaysia/comments/i95vei,2020-08-14 14:39:59,2021-04-2316:01:32
jmanx360,Epic is the new EA,https://www.reddit.com/r/malaysia/comments/i95vei,2020-08-14 14:44:04,2021-04-2316:01:32
Cliff-Gamer,All of you switch to PUBG its almost the same,https://www.reddit.com/r/malaysia/comments/i95vei,2020-08-14 16:31:24,2021-04-2316:01:32
Slightly_Zen,"Putting everything GM else aside on who is good or bad. Once two parties have an agreement (in the form of a tens of service) and one party reneges on its agreed obligations, the second party has the right to apply any protections that the contract provides. 

This is the basis of any business agreement. Epic can take apple to court for monopolistic practices or whatever. A s even challenge the provisions of a existing contract, but while that matter continues the terms of the contract also stand as do its provisions. 

In that Epic cannot claim to have been wronged.",https://www.reddit.com/r/malaysia/comments/i95vei,2020-08-14 17:40:41,2021-04-2316:01:32
albeva,"This is an interesting one. On one hand I am on Apple's side. They invest a lot in development, infrastructure and ultimately it is their store and their rules. So if someone wants to do business on their platform they need to be prepared to pay for the privilege.

On the other hand App store has become a monopoly and their policies are directly harming users and apps have suffered. Less features or more complicated to use due to ""no mentioning of outside websites / subscriptions / etc."".

And then of course special deals apple dishes out to select few. E.g. Amazon.

There is no denying Apple has been using anti competitive practices here and misusing their sole dominant monopoly in the app store and its policies.

So I do think this is a battle needing fought, but I do not see it as just black & white issue.",https://www.reddit.com/r/malaysia/comments/i95vei,2020-08-14 18:04:43,2021-04-2316:01:32
Soylentgruen,Bold move biting the platforms that host your game. Perhaps make your own independent hardware.,https://www.reddit.com/r/malaysia/comments/i95vei,2020-08-14 20:01:12,2021-04-2316:01:32
CoolAppz,so they tried to set a store inside a store and are pissed for having their asses kicked? Assemble a booth inside Walmart and try to sell your products there without giving Walmart a cut. People think Apple is a charity.,https://www.reddit.com/r/malaysia/comments/i95vei,2020-08-15 01:30:15,2021-04-2316:01:32
TheAuggieboy,"So you get invited to the “popular” aka Apple and Google party have to pay $10 to get in the front door, but go in the back and charge people $5 for a party that’s not yours btw, and they’re mad about it? There’s a price to be paid for ease of download access to billions of devices that you don’t own or have created. Not to mention these sales are not even on tangible products by Epic, it’s all digital sales. Greedy company calling others a monopoly. Smh..",https://www.reddit.com/r/malaysia/comments/i95vei,2020-08-15 02:33:10,2021-04-2316:01:32
saucytryhard,FINALLY,https://www.reddit.com/r/malaysia/comments/hdxmzf,2020-06-23 02:19:56,2021-04-2316:01:32
severinskulls,"When the iOS section ended and they moved on to iPadOS, I was so mad that they didn't address this. THEN, he announced notification style call dialogues and I was MAD that it would be iPad only. I am so happy that this annoyance is FINALLY sorted!!!!!!!",https://www.reddit.com/r/malaysia/comments/hdxmzf,2020-06-23 02:51:17,2021-04-2316:01:32
iqstick,Greatest thing about this is now I can ignore someone without them knowing I'm ignoring them while continuing to use my phone,https://www.reddit.com/r/malaysia/comments/hdxmzf,2020-06-23 03:28:20,2021-04-2316:01:32
timomonochrom,"Anyone else confused with the new siri animation?

Sure it doesn't take up the entire screen anymore but WHY so inconsistent with the new call animation and siri on mac? It's like it is inconsistent on purpose.",https://www.reddit.com/r/malaysia/comments/hdxmzf,2020-06-23 03:03:53,2021-04-2316:01:32
ze_DaDa,🦀 IT IS GONE 🦀,https://www.reddit.com/r/malaysia/comments/hdxmzf,2020-06-23 02:51:02,2021-04-2316:01:32
Tinysnowdrops,"This feature came out at both the best and worse time. FaceTimed my family back home in Asia during the last few minutes before she passed away just now. Received a call and it blocked the entire screen and ended the screen recording, just 10 seconds before she said farewell. I truly mean it when I say I CANT WAIT for the feature to be implemented.",https://www.reddit.com/r/malaysia/comments/hdxmzf,2020-06-23 04:06:43,2021-04-2316:01:32
CarbonLibra,"Dearly beloved,  
You will be missed.


Scorpion  
CallBar XS  
NiceCaller  
also (upcoming) Triton


*May you Rest In Peace**",https://www.reddit.com/r/malaysia/comments/hdxmzf,2020-06-23 03:12:09,2021-04-2316:01:32
JungleStirFry,It seriously took 14 years 😂,https://www.reddit.com/r/malaysia/comments/hdxmzf,2020-06-23 02:20:13,2021-04-2316:01:32
Noerdy,Really happy about this.,https://www.reddit.com/r/malaysia/comments/hdxmzf,2020-06-23 02:21:17,2021-04-2316:01:32
Drunkyoda5,"All right, where’s that dude who kept defending apples decision not to do this before? I wanna hear their reaction, now.",https://www.reddit.com/r/malaysia/comments/hdxmzf,2020-06-23 03:32:20,2021-04-2316:01:32
Speaker4theRest,"But....and maybe I missed this...what happens in the background when (if you can) swipe this up and away? Does the call ring out to VM or does the swipe away send right to VM? The visual is nice, but what is the back end?",https://www.reddit.com/r/malaysia/comments/hdxmzf,2020-06-23 02:54:56,2021-04-2316:01:32
,Finally! Amazing how similar it looks to the concepts made up by independent designers.,https://www.reddit.com/r/malaysia/comments/hdxmzf,2020-06-23 02:54:57,2021-04-2316:01:32
Call_Me_Tsuikyit,It’s about time,https://www.reddit.com/r/malaysia/comments/hdxmzf,2020-06-23 02:21:13,2021-04-2316:01:32
lemanifij,At last. Now I can switch to iPhone comfortably.,https://www.reddit.com/r/malaysia/comments/hdxmzf,2020-06-23 03:00:30,2021-04-2316:01:32
Whateversclever7,Am I the only one who likes to see giant full screen photos of my friends pop up when they call? I hope you have the option to still do that. I always pick the nicest pictures to have pop up.,https://www.reddit.com/r/malaysia/comments/hdxmzf,2020-06-23 04:49:33,2021-04-2316:01:32
TheJadedSF,"People still make phone calls?

Sincerely,

A Millennial

/s (sort of)",https://www.reddit.com/r/malaysia/comments/hdxmzf,2020-06-23 02:41:40,2021-04-2316:01:32
_Kristian_,Wouldnt top right to be better for join call? Its quite a reach to top left,https://www.reddit.com/r/malaysia/comments/hdxmzf,2020-06-23 02:34:02,2021-04-2316:01:32
mgd09292007,UGH...im gonna miss all the SPAM calls interrupting the meaningful things that I am doing :(,https://www.reddit.com/r/malaysia/comments/hdxmzf,2020-06-23 04:46:24,2021-04-2316:01:32
