author,comment,URL,Comment Time,Crawl Time
Lachimanus,"Since people of the apple like to pay a little more for their phone:

Why not pay money for quality websites?",https://www.reddit.com/r/malaysia/comments/7enkwk,2017-12-29 07:39:22,2021-04-2316:29:41
runnercto,MODS!!! Make this post an announcement!!,https://www.reddit.com/r/malaysia/comments/7enkwk,2017-11-22 11:32:08,2021-04-2316:29:41
acid69,"These are the emails of those in the FCC who will most likely vote against net neutrality, let them know you oppose of it and spread the word!

ajit.pai@fcc.gov

Mignon.clyburn@fcc.gov 

Mike.O'Rielly@fcc.gov",https://www.reddit.com/r/malaysia/comments/7enkwk,2017-11-22 14:44:15,2021-04-2316:29:41
efe282,"Use resist bot on cell phone.It will send your text messages as faxes to senators / representatives. Just type 'resist' to 50409 and follow instructions. Yes, that easy!#resist #resistbot
",https://www.reddit.com/r/malaysia/comments/7enkwk,2017-11-22 14:39:03,2021-04-2316:29:41
D3M0NSLAY3R10,"Even though it sucks that the FCC is trying to take away net neutrality, it is awesome how the internet has come together to stop this problem.",https://www.reddit.com/r/malaysia/comments/7enkwk,2017-11-22 14:44:23,2021-04-2316:29:41
,"In order to save the internet, one of these 3 men have to change their mind and vote in favor of net neutrality. Tweet at them directly and let them know what you think:
https://twitter.com/AjitPaiFCC
https://twitter.com/BrendanCarrFCC
https://twitter.com/mikeofcc
Not many people have tweeted at them from what I can see, this might be the best way to make your voice heard.
Also:
https://www.fcc.gov/about/leadership Their individual contact information can be found under ""Bio"".
The three men plan to vote to repeal net neutrality. The two women plan to vote to keep net neutrality.
To defeat the net neutrality repeal, one of those three men has to change their vote. Pass it on!",https://www.reddit.com/r/malaysia/comments/7enkwk,2017-11-22 15:49:09,2021-04-2316:29:41
kaihiggins,I don’t know if this has been shared but there’s a White House petition! https://petitions.whitehouse.gov/petition/do-not-repeal-net-neutrality WE CAN DO THIS!,https://www.reddit.com/r/malaysia/comments/7enkwk,2017-11-22 16:37:20,2021-04-2316:29:41
knvngy,This pro net neutrality spam is everywhere. Corporate bots and minions  at full throttle ,https://www.reddit.com/r/malaysia/comments/7enkwk,2017-11-22 23:31:31,2021-04-2316:29:41
,"Honestly though, we can link this to 6 degrees of separation to Kevin Bacon. I'll start, Net Neutrality being in danger is because of the success of microtransactions in EA games",https://www.reddit.com/r/malaysia/comments/7enkwk,2017-11-22 14:46:48,2021-04-2316:29:41
ReticentVent,"https://www.reddit.com/r/KeepOurNetFree/comments/7elbs5/guys_net_neutrality_is_important/dq6fvt2



>In order to save the internet, one of these 3 men have to change their mind and vote in favor of net neutrality. Tweet at them directly and let them know what you think:

>https://twitter.com/AjitPaiFCC

>https://twitter.com/BrendanCarrFCC

>https://twitter.com/mikeofcc

>Not many people have tweeted at them from what I can see, this might be the best way to make your voice heard.
",https://www.reddit.com/r/malaysia/comments/7enkwk,2017-11-22 14:59:13,2021-04-2316:29:41
Itshammertimebitch,"[Net Neutrality post on r/roosterteeth] (https://www.reddit.com/r/roosterteeth/comments/7ejhnq/us_rooster_teeth_fans_your_ability_to_watch_their/)

If you're in the US, it's important that you understand how the vote on December 14th is going to work. Look at [this](https://www.reddit.com/r/television/comments/7ekrpi/the_fcc_just_announced_its_plan_to_slash_net/dq5pzj5/) comment 

> FYI - Congress and the Senate have nothing to do with this. Only five people at the FCC get to vote.

>[Here they are](https://www.fcc.gov/about/leadership). The three men plan to vote to repeal net neutrality. The two women plan to vote to keep net neutrality.

>Their individual contact information can be found under ""Bio"".

>To defeat the net neutrality repeal, one of those three men has to change their vote.
 
I’m not taking credit for this just sharing the info.",https://www.reddit.com/r/malaysia/comments/7enkwk,2017-11-22 15:13:12,2021-04-2316:29:41
alethu88,"Hey all Europeans. Let’s chip in to save the internet. Even though we’re not Americans, this is what we can do to help! Even though it won’t directly bother us, it will most probably open doors for governments in Europe to follow in their footsteps. 

If you want a neutral internet, please sign these petitions and close the doors to a controlled internet:

https://www.change.org/p/save-net-neutrality-netneutrality

https://www.savetheinternet.com/sti-home",https://www.reddit.com/r/malaysia/comments/7enkwk,2017-11-22 21:17:54,2021-04-2316:29:41
Shryke_777,"TO ANYONE WHO IS DOUBTING THIS FAKE REDDIT INITIATIVE TO ""RESIST"" THE FCC
YOU ARE CORRECT IN YOUR DOUBTS
REDDIT IS UNDER ATTACK AN ARMY OF SHILLS PAID BY
***GEORGE SOROS***
WE KNOW WHAT YOU ARE UP TO
THIS IS A COMPLETELY FABRICATED MASS HYSTERIA WITH MILLIONS OF FAKE REDDIT BOTS PROVIDING DOWNVOTES AND SPAMMING THE SAME TOPIC SO IT WILL FLOAT TO THE TOP
IT IS SO NAKEDLY OBVIOUS
I SUPPORT THE REPEAL OF THE NET NEUTRALITY ACT
AND YOU SHOULD TOO!
RESTORE INTEGRITY
CLEAN UP THE INTERNET
DON'T FALL FOR MANUFACTURED INTERNET CONTROVERSY

***THE INTERNET WILL BE FINE***
***GET OFF THE COMPUTER AND GO LIVE YOUR LIFE***


*****DON'T.BE.A.LEMMING*****",https://www.reddit.com/r/malaysia/comments/7enkwk,2017-11-22 15:21:36,2021-04-2316:29:41
,"Net neutrality is a moronic idea, it flies in the face of basic Quality of Service principles. You don’t want all traffic treated equally. Some content such as VoIP, streaming, and gaming needs low latency and that means prioritizing it over other content. 

Just remove the regional telecom monopolies and let competitors enter the market. Net neutrality has nothing to do with the problems in the market.",https://www.reddit.com/r/malaysia/comments/7enkwk,2017-11-22 11:26:15,2021-04-2316:29:41
fsirddd,"Why should we rely on commercial corporations for internet access anymore after this?

Our  response should be to demand and petition the FEDERAL government to step in and build a free public internet!

For the money we pay the internet providers we should have the internet we want.

If they won't provide it we need to take that money back from the isp's in taxes to fund and build a government maintained alternative free public internet. 

Now is the perfect time to push for something like this and strike while the iron and tempers are hot!

There's no reason to rely on or trust these commercial entities with our digital communications any longer.
",https://www.reddit.com/r/malaysia/comments/7enkwk,2017-11-22 14:39:01,2021-04-2316:29:41
,[removed],https://www.reddit.com/r/malaysia/comments/7enkwk,2017-11-22 13:49:53,2021-04-2316:29:41
songofsixpence,"When I see this ""red flag"" this is a cue to do exactly the opposite. Want to go against the proverbial man? NN is not what it seems.",https://www.reddit.com/r/malaysia/comments/7enkwk,2017-11-22 14:06:22,2021-04-2316:29:41
mynamejeoff,"I wish I was able to blend in with the FCC crowd at whatever speech he will give, infiltrate it, and slap him in the face with a shoe, then gouge his eyes out",https://www.reddit.com/r/malaysia/comments/7enkwk,2017-11-22 17:29:24,2021-04-2316:29:41
ruralexcursion,GO REDDIT GO!!!!!,https://www.reddit.com/r/malaysia/comments/7enkwk,2017-11-22 14:08:00,2021-04-2316:29:41
httpsgooglqNJk1,"good stuff man
",https://www.reddit.com/r/malaysia/comments/7enkwk,2017-11-22 14:49:03,2021-04-2316:29:41
smokeygreen420,Land of the free.... ,https://www.reddit.com/r/malaysia/comments/7enkwk,2017-11-22 14:49:49,2021-04-2316:29:41
Baddaboombaddabing,Ajit has wares if you have coin...,https://www.reddit.com/r/malaysia/comments/7enkwk,2017-11-22 15:08:14,2021-04-2316:29:41
DigletDigler,"So if you haven't already, there's a bot you can text, that helps you write an email or a fax, free of charge, to your senator, or governor. Text ""resist"" to ""504-09"" and it'll ask you some questions, then you're onto writing. From another thread a few weeks ago, someone posted this message, and it think it's a great one to send.

""Net Neutrality is the cornerstone of innovation, free speech and democracy on the Internet.

Control over the Internet should remain in the hands of the people who use it every day. The ability to share information without impediment is critical to the progression of technology, science, small business, and culture.

Please stand with the public by protecting Net Neutrality once and for all.""

I'd love to credit the user, but have lost the comment, but please, go send some faxes, show your politicians you want net neutrality to stay.",https://www.reddit.com/r/malaysia/comments/7enkwk,2017-11-22 15:12:44,2021-04-2316:29:41
,"In the past, I was very vocal about net neutrality but a lot's changed
politically since now & then that makes me think that regardless
of who gets their way & the outcome, this is a very bad time
for anyone to take a reactionary position considering the series of
L's the left has racked up.  Before these regulations were put
in place, all of these nightmare scenarios largely rested upon
corporations buying policy that makes things worse & ISP's
illegally colluding to agree not to compete when it comes to
extorting users into paying for tiered service.
Obviously there's less nightmarish anti-competative actions
that we've already seen happen in the past like slowing down
Netflix but I can't help but feel like Net Neutrality riling people
up every year or 2 could be used as a psychological tactic
that brings people together across party lines in fear of losing
a part of life that we take for granted.  A subconscious reality
check like that is definitely a good idea & without sounding like
I'm making a Thanksgiving pun, right now is a great time to
attempt a little reset like that on our collective political conscience.


And as a side note, I found it interesting that the increased news
coverage suddenly had my parents both asking me what exactly
""net neutrality"" means since they remember me talking about
it years ago.  It's not every day that I get to explain something
complicated without quickly getting a ""Never mind, I'm too dumb
for this"" or ""Since I can't defend my pre-programming in this
discussion, I'm just going to shut the discussion down by slinging
bullshit in all directions until you fatigue & walk away"".",https://www.reddit.com/r/malaysia/comments/7enkwk,2017-11-22 15:19:48,2021-04-2316:29:41
m1ksuFI,Why should freak out about net neutraloty? I live in Europe.,https://www.reddit.com/r/malaysia/comments/7enkwk,2017-11-22 15:26:35,2021-04-2316:29:41
oddshouten,Your*,https://www.reddit.com/r/malaysia/comments/7enkwk,2017-11-22 15:31:26,2021-04-2316:29:41
Rvmntrx,#TOTALLY GRASSROOTS ,https://www.reddit.com/r/malaysia/comments/7enkwk,2017-11-22 15:52:51,2021-04-2316:29:41
Llama_Juice,"Is there anything we can do to help, even if we don’t live in the US? ",https://www.reddit.com/r/malaysia/comments/7enkwk,2017-11-22 16:29:25,2021-04-2316:29:41
juniperjumpercables,"For all non Americans who want to help I’ve been directed to this URL: 

https://petitions.whitehouse.gov/petition/replace-ajit-pai-fcc-restore-net-neutrality-make-last-mile-networking-public-utility-and-stop-corporate-abuse-0

Remember to confirm your signature and let’s try and get this shit sorted ",https://www.reddit.com/r/malaysia/comments/7enkwk,2017-11-22 17:07:56,2021-04-2316:29:41
PrimarisMarine,"In the apple sub LOL.
Apple would love to pay you extra to use their shit.

OH WAIT you already do..",https://www.reddit.com/r/malaysia/comments/7enkwk,2017-11-22 18:45:46,2021-04-2316:29:41
tmcgee2481,"Never forget what it could all become: 

https://i.imgur.com/2OFtIcx.jpg",https://www.reddit.com/r/malaysia/comments/7enkwk,2017-11-22 20:10:53,2021-04-2316:29:41
MkMouze,Quick site to visit: https://petitions.whitehouse.gov/petition/do-not-repeal-net-neutrality,https://www.reddit.com/r/malaysia/comments/7enkwk,2017-11-23 01:41:03,2021-04-2316:29:41
,"An APPLE sub getting upset at the idea of a free market. Oh, the absolute irony. 

edit: Upvotes or downvotes will not change the truth.",https://www.reddit.com/r/malaysia/comments/7enkwk,2017-11-22 11:46:40,2021-04-2316:29:41
thailoblue,Doesn’t relate to Apple. Go ship in your own sub.,https://www.reddit.com/r/malaysia/comments/7enkwk,2017-11-22 12:22:14,2021-04-2316:29:41
neazmoh,I don’t get it u guys vote for these govt. reap what u sow,https://www.reddit.com/r/malaysia/comments/7enkwk,2017-11-22 15:06:34,2021-04-2316:29:41
Fullback520,"WE CAN STILL FIGHT!! White house petition for Net Neutrality!!!

https://petitions.whitehouse.gov/petition/do-not-repeal-net-neutrality",https://www.reddit.com/r/malaysia/comments/7enkwk,2017-11-22 15:09:04,2021-04-2316:29:41
cis_white_guy,Here is a White House petition to [save Net Neutrality.](https://petitions.whitehouse.gov/petition/do-not-repeal-net-neutrality),https://www.reddit.com/r/malaysia/comments/7enkwk,2017-11-22 15:29:05,2021-04-2316:29:41
shabbaranksx,Everybody has this preconceived notion that the internet providers will have a tiered subscription... what if they don’t?,https://www.reddit.com/r/malaysia/comments/7enkwk,2017-11-22 13:38:19,2021-04-2316:29:41
panditmurari,"Love problam solution astrologer in India so call me now +91-9352436734
",https://www.reddit.com/r/malaysia/comments/7enkwk,2017-11-22 14:46:55,2021-04-2316:29:41
Frodo73,"Sign the White House petition if you care about Net Neutrality. 

https://petitions.whitehouse.gov/petition/do-not-repeal-net-neutrality",https://www.reddit.com/r/malaysia/comments/7enkwk,2017-11-22 21:05:49,2021-04-2316:29:41
knvngy,"Please people , report this kind of  spam.",https://www.reddit.com/r/malaysia/comments/7enkwk,2017-11-22 23:31:52,2021-04-2316:29:41
,plz no more,https://www.reddit.com/r/malaysia/comments/7enkwk,2017-11-22 14:23:13,2021-04-2316:29:41
jones_ok,Reported. Spam.,https://www.reddit.com/r/malaysia/comments/7enkwk,2017-11-22 13:44:08,2021-04-2316:29:41
