author,comment,URL,Comment Time,Crawl Time
exjr_,"I have chosen to sticky this post as this is an important matter that should concern us all.

To have an idea of what’s going on, read this excerpt by /u/cocobandicoot:

>	Net neutrality today is about preventing abuse. It protects consumers from mega corporations and Internet service providers from (potentially) making major changes in how the Internet works, including (among other things) the possibility of charging users for the types of content they enjoy, rather than treating all data equally. That's a pretty big deal, and not out of the realm of possibility based on comments from ISPs, as well as a number of examples of how ISPs have already started abusing their power.

>	There isn't enough competition in the ISP market to go without net neutrality, and these corporations are working hard to lobby politicians into enacting laws that prevent or make it difficult for new ISPs to be successful.

>	For all these reasons, if we want the Internet to continue to work the way it has all these years, you should be encouraging your representatives to urge the FCC to keep net neutrality and ""Title II"" (2) regulation.

>	ISPs already have proven that without rules in place, they will behave in a way that can dictate how you use your internet connection.

([Link to comment](https://reddit.com/r/apple/comments/7enkwk/_/dq6eqp6/?context=1))

—-

We don’t have much time left. The Federal Communications Commissions (FCC) will vote to eliminate Net Neutrality on December 14th. 

In the OP, you can put your phone number to let the U.S. Congress now that you don’t want this at all. Verizon, AT&T, Time Warner and Comcast are looking to control what you see and what you can access! 

Interested in knowing what Apple has to say about this? [This document should help: https://ecfsapi.fcc.gov/file/10830069155074/NN%20reply%20comments%20(final).pdf 

Act now! ",https://www.reddit.com/r/malaysia/comments/7enkwk,2017-11-22 11:54:31,2021-04-2316:01:32
Matuteg,"Remember when ATT wanted to block FaceTime over cellular? Well, that to all your services. ",https://www.reddit.com/r/malaysia/comments/7enkwk,2017-11-22 12:20:25,2021-04-2316:01:32
TinTinCT617,Any chance Pai has committed sexual harassment in the past?  Does he have any skeletons in his closet that could end his career?,https://www.reddit.com/r/malaysia/comments/7enkwk,2017-11-22 12:56:22,2021-04-2316:01:32
,[removed],https://www.reddit.com/r/malaysia/comments/7enkwk,2017-11-22 13:36:20,2021-04-2316:01:32
OldTrafford25,Surprised this sub isn't more vocal about Net Neutrality. ,https://www.reddit.com/r/malaysia/comments/7enkwk,2017-11-22 11:23:50,2021-04-2316:01:32
freebies,"Copied from a previous thread

And this is why we need to fight for an open, free internet.

Rules I like to follow :

• Always use a VPN (/r/Nologsvpn). This will encrypt your data so that no third parties are able to get it (ISPs etc) it also helps bypass Geo blocks, and protocol throttling.

• Keep your social media usage as little as possible.

• Use throwaway accounts on Reddit. Especially if you give away identifying information or post in local subreddits.

• Extra tip, use PGP on sensitive exchanges.

If anyone has any extras please share! :)",https://www.reddit.com/r/malaysia/comments/7enkwk,2017-11-22 15:53:53,2021-04-2316:01:32
SuchUserHasBeenTaken,Just start upvoting every single possible post you can supporting net neutrality,https://www.reddit.com/r/malaysia/comments/7enkwk,2017-11-22 11:23:50,2021-04-2316:01:32
monkeyinthedonkey,This is only america right?,https://www.reddit.com/r/malaysia/comments/7enkwk,2017-11-22 14:15:41,2021-04-2316:01:32
BrazenlyGeek,An Internet that allows service providers to charge you extra for the use of iMessage rather than their native SMS is an Internet I don't want any part of!,https://www.reddit.com/r/malaysia/comments/7enkwk,2017-11-22 13:38:18,2021-04-2316:01:32
Main_User2,How many times is this going to have to be fought for?,https://www.reddit.com/r/malaysia/comments/7enkwk,2017-11-22 13:59:04,2021-04-2316:01:32
thescho,"Where's the Anonymous group when you need them?



/s",https://www.reddit.com/r/malaysia/comments/7enkwk,2017-11-22 13:58:18,2021-04-2316:01:32
The_Apex_Predditor,"Credit to u/datums for this comment:

FYI - Congress and the Senate have nothing to do with this. Only five people at the FCC get to vote.
  
[Here they are](https://www.fcc.gov/about/leadership). The three men plan to vote to repeal net neutrality. The two women plan to vote to keep net neutrality. 
  
Their individual contact information can be found under ""Bio"".  
  
To defeat the net neutrality repeal, one of those three men has to change their vote. ",https://www.reddit.com/r/malaysia/comments/7enkwk,2017-11-22 15:30:11,2021-04-2316:01:32
DoctorPepeX,What if I told you Ajit Pai doesn’t give a crap about your upvotes?,https://www.reddit.com/r/malaysia/comments/7enkwk,2017-11-22 11:51:13,2021-04-2316:01:32
,"We could just recreate the internet if it really comes down to it, and instead of having large servers and instead of ISP’s controlling the web, it could be run by the users. Just food for thought. Also, let me know if I’m out of the loop and there is something like this.",https://www.reddit.com/r/malaysia/comments/7enkwk,2017-11-23 02:57:44,2021-04-2316:01:32
puterTDI,"I did this last time. Here's what happened:

1) constant spamming for other causes. Fortunately, unsubscribe worked (after I did it for several of their lists)

2) Text messages. No way to unsubscribe. Eventually I replied cursing them out and got a text back saying they'd take me off the list

I will never take part in ""battle for the net"" again. e-signing an initiative should not commit me to email and text spam.",https://www.reddit.com/r/malaysia/comments/7enkwk,2017-11-22 14:18:25,2021-04-2316:01:32
berrymetal,Americans are fucked...,https://www.reddit.com/r/malaysia/comments/7enkwk,2017-11-22 14:52:02,2021-04-2316:01:32
,[deleted],https://www.reddit.com/r/malaysia/comments/7enkwk,2017-11-22 14:43:57,2021-04-2316:01:32
,[deleted],https://www.reddit.com/r/malaysia/comments/7enkwk,2017-11-22 23:07:37,2021-04-2316:01:32
cameroncafe10a,"Wow, this is the most upvoted post in r/Apple by a huge margin!",https://www.reddit.com/r/malaysia/comments/7enkwk,2017-11-24 07:17:34,2021-04-2316:01:32
,"The internet ran just fine before NN was imposed in 2014/5.   


    Take a deep breath, and remember, if you like your healthcare plan, you can keep your healthcare plan. 

    Also, the typical american family will save on average $2500/year on their healthcare costs. 


Just remember, the more your mom and dad involve themselves in your life, the less freedoms you will have.  Same with government. ",https://www.reddit.com/r/malaysia/comments/7enkwk,2017-11-23 00:07:43,2021-04-2316:01:32
PizzaFartyParty,Your*,https://www.reddit.com/r/malaysia/comments/7enkwk,2017-11-22 11:40:47,2021-04-2316:01:32
Metriacanthosaurus,"Goddamn why are you people so fucking stupid? You don't want government regulation of the internet, even if you think you do.",https://www.reddit.com/r/malaysia/comments/7enkwk,2017-11-22 22:55:23,2021-04-2316:01:32
AU_Thach,Can we keep the protests to the right subreddits? My home page being filled is really annoying. ,https://www.reddit.com/r/malaysia/comments/7enkwk,2017-11-22 19:54:45,2021-04-2316:01:32
Mageeta,"I’m sorry but you can no longer view or post to your favorite social media site/app, without buying the additional ‘social media package’ for +$15 a month.  You however can post for free to our new great fuckUover social site for free, we own that, it’s awesome, we use all your data to data mine more creepy invasive ads! However, you can only buy online from FuckUbuyonlyfromUs commercial site, where we only sell our shitty partnered products and stifle innovation. If you want to buy things from Amazon, you will need to buy our ‘Online retail package’ for +$25 a month. We are so happy and proud we are now able to give you the freedom of access to just what we want you to see. Thanks GOP!

~Duopoly ISPs most likely

ResistBot is the most efficient way to contact your Senators, Reps, Governor, and the President. Text ""resist"" to ""504-09” to Fight for Net Neutrality They will ask for your name and other info to contact your respective state officials via fax, letters, and email. 

Here is a great message you can send:
**""Net Neutrality is the cornerstone of innovation, free speech and democracy on the Internet. Control over the Internet should remain in the hands of the people who use it every day. The ability to share information without impediment is critical to the progression of technology, science, small business, and culture. Please stand with the public by protecting Net Neutrality once and for all.""**

ResistBot is run by an all-volunteer non-profit by and for patriotic Americans who want to have their voices heard. ResistBot is completely free to use! But, they pay for postage, faxes, and hosting with donations from users like you. Every dollar funds 100 messages to Congress. Please donate if you want to keep ResistBot going: https://resistbot.io/donate/ **Feel free to copy my post and spread to the masses! BE PROACTIVE AND KEEP OUR INTERNET FREE**

Another way is: 
https://democracy.io/#!/",https://www.reddit.com/r/malaysia/comments/7enkwk,2017-11-22 14:15:28,2021-04-2316:01:32
HugeLibertarian,"This is so inappropriate for this sub. People come here to talk about apple products, not politics. But since you started it, I'll bite. Would you rather a multitude of competing private entities have the ability to play favorites with internet traffic, but a massive financial incentive NOT to do so, or would you rather the federal government, with no competition, to have that same ability, but with a massive financial and political incentive TO do so? https://youtu.be/0cLWgTIsMLM",https://www.reddit.com/r/malaysia/comments/7enkwk,2017-11-22 16:33:24,2021-04-2316:01:32
WDJ1924,"The mis-direction and public gullibility is staggering.  ""Net Neutrality"" is a wolf in sheep's clothing.  DO THE RESEARCH !  ""Net Neutrality"" by the previous FCC put Internet Services under Title 2 of the Communications  Act of 1934. That's right 1934 !  The Title 
 2 portion of the Communications Act of 1934 controls and regulates landline telephone service. So the former FCC, in the guise of ""Net Neutrality"" equated landline phone service and Internet Services for regulation purposes!!  Who in their right mind can call that a good thing.  The Internet has flourished because it has  NOT been regulated as a landline phone...the past FCC changed that with the ""Net Neutrality"" lie designated Internet Service as a Title 2 service.

""Net Nuetrality"" means two things...government control and taxation.  Look at your Internet bill....no tax is paid!!!!!  Under Title 2 inclusion by the previous FCC, that door is opened !!!

Stop with the nonsensical big bad wolf corporation rhetoric and do the research.  Having Internet Service regulated under an Act created in 1934 for landline telephone service is ridiculous.

Wake up!  The Net Neutrality lie is about Government  Control and the ability to Tax Internet Service at  the Federal level !!!! ",https://www.reddit.com/r/malaysia/comments/7enkwk,2017-11-23 00:38:59,2021-04-2316:01:32
,ELI5: FCC is an agency of the US government. What does this mean for the rest of the world and how will it apply for the same?,https://www.reddit.com/r/malaysia/comments/7enkwk,2017-11-22 14:39:47,2021-04-2316:01:32
ThomasMaker,"Something doesn't smell right...

First false information in a formula:

""these big companies support net neutrality, so it's bad"", then they proceed to list companies that are actually AGAINST NN.

https://www.opensecrets.org/news/issues/net_neutrality/

VERIZON, ATT, COMCAST have all lobbied excessively AGAINST NN.

There is a reason. You need to dig deeper to understand. They aren't trying to stop censorship. They are censorship. They already censor all over the web. They already censor media from trending on social media. They tell us some links are fake news. Hell, they censor us on this website right now. The hypocrisy is overwhelming. The censorship is here. What people don't get is that it is already happening but ask yourself if sites are already being censored then why do the globalists want NN? It's real simple. They will selectively enforce. They will allow their buddies to break the rules and enforce the rules against their opponents. Better to remove the rules so everyone is on an even playing field and then use anti trust laws already on the books to stop them from targeting businesses. Before NN there were almost no cases of actual abuse. Don't give me some bs link about some isp in Canada. Also, all that abuse was already illegal based on our current laws for antitrust and consumer protections. Right now we need to get rid of the title 2 regulations so people can get more service provider options. Then if your isp starts slowing certain traffic you can switch.

There is an end game here. It is not just what you see right now on the front page. Remove NN, remove title 2, allow more ISPs to compete, if they provide bad service you can switch to one that will not slow traffic. That is the real plan, not reddit's bullshit. And if you want to argue the ISPs will not compete because they like to create monopolies I still say it's better to have no regulation and antitrust laws than regulation that can be selectively enforced by the globalists if they get the right people in office. We aren't going to let them control everything. Things were working just fine before NN and they will work just fine after NN.",https://www.reddit.com/r/malaysia/comments/7enkwk,2017-11-22 20:09:21,2021-04-2316:01:32
Frosty4l5,"FCC also a massive liar

check this out
https://medium.com/@vajrajames/ajit-pais-fcc-looking-at-false-public-comments-c5c82a72d22",https://www.reddit.com/r/malaysia/comments/7enkwk,2017-11-22 14:27:38,2021-04-2316:01:32
levya25,This is amazing. I can't believe how much control these companies already have!,https://www.reddit.com/r/malaysia/comments/7enkwk,2017-11-22 14:54:11,2021-04-2316:01:32
apearsonio,Do you part?,https://www.reddit.com/r/malaysia/comments/7enkwk,2017-11-22 13:34:20,2021-04-2316:01:32
Luminous_Fantasy,Its funny because I haven't seen an apple official step out and support this. ,https://www.reddit.com/r/malaysia/comments/7enkwk,2017-11-22 14:13:50,2021-04-2316:01:32
,[removed],https://www.reddit.com/r/malaysia/comments/7enkwk,2017-11-22 21:40:25,2021-04-2316:01:32
ilikeweirdthingstoo,Your*,https://www.reddit.com/r/malaysia/comments/7enkwk,2017-11-22 14:09:21,2021-04-2316:01:32
funkinthetrunk,I currently reside outside of the US and have a foreign phone number. What should I do?,https://www.reddit.com/r/malaysia/comments/7enkwk,2017-11-22 14:25:12,2021-04-2316:01:32
ajlunce,"I remember back when the nightmare scenario for the end of net neutrality was charging more to get more bandwidth, blocking of whole sites by ISPs is horrifying and needs to be stopped",https://www.reddit.com/r/malaysia/comments/7enkwk,2017-11-22 14:31:20,2021-04-2316:01:32
smccucsdcsunpu,How is internet access delivered for free?,https://www.reddit.com/r/malaysia/comments/7enkwk,2017-11-22 14:38:15,2021-04-2316:01:32
atomic_kraken,I’m American but I’ve lived overseas for a few years. Who do I call for this? My reps from the last place I lived in America or someone else?,https://www.reddit.com/r/malaysia/comments/7enkwk,2017-11-22 14:42:48,2021-04-2316:01:32
Goeseeff,Does this only affect the USA? If so is there anything else beside calling them to do? I’d really like to help you.,https://www.reddit.com/r/malaysia/comments/7enkwk,2017-11-22 14:56:54,2021-04-2316:01:32
IncomingTrump270,"To quote a post that was deleted:

>A quarter billion dollar website, owned by a multi-billion dollar publishing conglomerate, carpet bombing its users, pushing the narrative for more government regulation. Not fishy at all...",https://www.reddit.com/r/malaysia/comments/7enkwk,2017-11-22 15:13:45,2021-04-2316:01:32
Gamzrok24,"White house petition to stop this crap! Everything helps. 

https://petitions.whitehouse.gov/petition/do-not-repeal-net-neutrality",https://www.reddit.com/r/malaysia/comments/7enkwk,2017-11-22 15:54:12,2021-04-2316:01:32
prophetsofrage,Is this US only?,https://www.reddit.com/r/malaysia/comments/7enkwk,2017-11-22 15:54:33,2021-04-2316:01:32
PM_ME_YOUR_TIPS_GRL,Something I haven't been able to find out yet is whether this affects countries outside the US.  Can anyone point me to information about this?,https://www.reddit.com/r/malaysia/comments/7enkwk,2017-11-22 16:00:43,2021-04-2316:01:32
p5-f20w18k,"I’m in the UK, and I see that this is happening in the US, is there anything we can do from across the pond? ",https://www.reddit.com/r/malaysia/comments/7enkwk,2017-11-22 16:35:43,2021-04-2316:01:32
,Will this affect worldwide internet users?  Or is this solely a US thing?,https://www.reddit.com/r/malaysia/comments/7enkwk,2017-11-22 17:37:17,2021-04-2316:01:32
Jayreddin,"I’m from Ireland so not sure if this would affect me (more than likely will at some point).

I have one question. So my phone provider is [Eir](https://eir.ie), with Eir I get free services like YouTube, Facebook, WhatsApp to name a few. Would that be classed as against net neutrality? 

My eyes were open with all this with the FCC going on and IMO it’s my providers way of ensuring I use certain services without me thinking of it. The fact they offer these services for free would automatically put any competitors to these services to bed. 

Am I mad or is there logic in my thinking?",https://www.reddit.com/r/malaysia/comments/7enkwk,2017-11-22 18:02:42,2021-04-2316:01:32
Blahrgy,/r/unclogged/ stands with you to keep the internet UNCLOGGED.,https://www.reddit.com/r/malaysia/comments/7enkwk,2017-11-22 18:14:35,2021-04-2316:01:32
alextrandafirescu,"can participate if I live in France? and yeah, obviously I have a frenc phone number",https://www.reddit.com/r/malaysia/comments/7enkwk,2017-11-22 19:17:08,2021-04-2316:01:32
,So many links and others opinions about it but I cannot find anywhere that links to the actual FCC plan. Can someone send it to me so I can review it for myself? ,https://www.reddit.com/r/malaysia/comments/7enkwk,2017-11-22 20:48:39,2021-04-2316:01:32
JacksSmirknRevenge,People please just watch this video before you jump on this Title II bandwagon: https://youtu.be/8j95dVw6Kbc?t=4m55s,https://www.reddit.com/r/malaysia/comments/7enkwk,2017-11-22 21:21:02,2021-04-2316:01:32
captainquinlan,"For those of you that don’t like speaking on the phone you can text RESIST to 50409 and Resistbot will help you send an email to your reps. Here’s the body of the letter that I sent. You can also use it as a script if you decide to call:
“I support “Title Two” net neutrality rules and I urge you to oppose the FCC’s plan to repeal them. Specifically, I’d like you to contact the FCC Chairman and demand that he abandon his current plan. This issue is very dear to me and I will be watching very closely to see how you and your fellow representatives respond. Your actions on this matter will reflect how I vote during upcoming elections. I urge you to make the right decision and keep the internet free for your constituents. “",https://www.reddit.com/r/malaysia/comments/7enkwk,2017-11-22 21:37:16,2021-04-2316:01:32
ACalz,We elect people that are supposed to represent our best interests. What's the point of congress if they're going to pull shit like this?,https://www.reddit.com/r/malaysia/comments/7enkwk,2017-11-22 22:24:38,2021-04-2316:01:32
SolidSauce,Do not forget and make no mistake this is because of Trump the doer of all things greedy and disgusting.,https://www.reddit.com/r/malaysia/comments/7enkwk,2017-11-22 22:36:48,2021-04-2316:01:32
,"For my clarification, summarise this “Fight”, I may be Australian, and it may not affect me, but I would like some explanation as to what is going on.",https://www.reddit.com/r/malaysia/comments/7enkwk,2017-11-22 22:53:22,2021-04-2316:01:32
Rickyhaverland,"[these 5 people](https://www.fcc.gov/about/leadership)  are the ones voting on the topic! Make sure you email them and contact them! We need to tell the two women who are for net neutrality that we support them and the other 3 that we are for it and against their beliefs! It’s a vote between FCC chairmen, which is 3 republicans who are against net neutrality (men) and 2 who are for it (women). Make sure you are in contact with them JUST AS MUCH. SAVE THE NET",https://www.reddit.com/r/malaysia/comments/7enkwk,2017-11-22 23:30:36,2021-04-2316:01:32
crudos_na,"All hail our internet overlords. They know what is best for us and what we need to see. The hive will conquer all!

/s",https://www.reddit.com/r/malaysia/comments/7enkwk,2017-11-22 23:32:16,2021-04-2316:01:32
Royalrenogaming,"WHAT TO DO IF YOU'RE A LAZY REDDITOR WITH ANXIETY WHO TRIES TO HELP WITH JUST UPVOTES:

Here are 2 petitions to sign, one international and one exclusively US. 

International: https://www.savetheinternet.com/sti-home

US: https://petitions.whitehouse.gov/petition/do-not-repeal-net-neutrality

Text ""resist"" to 504-09. It's a bot that will send a formal email, fax, and letter to your representatives. It also finds your representatives for you. All you have to do is text it and it holds your hand the whole way. 

WAY too many people are simply upvoting and hoping that'll be enough, this is the closest level of convenience to upvoting you can find WHILE actually making a difference. 

This effects us all.
DO. YOUR. PART.

Edit: Shoutout to u/MomDoesntGetMe for putting this together.",https://www.reddit.com/r/malaysia/comments/7enkwk,2017-11-22 23:47:07,2021-04-2316:01:32
Neighinator,"I support net neutrality, but why is this all over the front page? The vote's in like 3 weeks",https://www.reddit.com/r/malaysia/comments/7enkwk,2017-11-22 23:54:33,2021-04-2316:01:32
UKFan643,"People should understand that Congress has no say in this. The original rules put in place under the Obama administration did not go through Congressional approval and so this administration can reverse those rules without Congressional approval. You can of course make your opinion known but Congress will do nothing with this.

Source: work for a member of Congress",https://www.reddit.com/r/malaysia/comments/7enkwk,2017-11-23 00:17:42,2021-04-2316:01:32
gerg71,This is a consumer driven argument. If ISPs decide to charge more for websites then just stop using the internet. Stop using a smartphone. The consumer has more power than the big business.  I’m willing to stop paying for anything internet related. ,https://www.reddit.com/r/malaysia/comments/7enkwk,2017-11-23 00:41:38,2021-04-2316:01:32
cercant01,I made my calls!,https://www.reddit.com/r/malaysia/comments/7enkwk,2017-11-23 00:50:18,2021-04-2316:01:32
RetroSpock,Is this a worldwide issue or is it only happening in the US?,https://www.reddit.com/r/malaysia/comments/7enkwk,2017-11-23 01:01:36,2021-04-2316:01:32
Hansolo_dolo,My congressman’s not picking up and his mailbox is full. What else can I do?,https://www.reddit.com/r/malaysia/comments/7enkwk,2017-11-23 01:44:56,2021-04-2316:01:32
Rocksand13,Can we use vpns to bypass this ?,https://www.reddit.com/r/malaysia/comments/7enkwk,2017-11-23 03:13:11,2021-04-2316:01:32
,Can someone PLEASE tell me whether California's congressmen are for or against Net Neutrality?!,https://www.reddit.com/r/malaysia/comments/7enkwk,2017-11-23 03:55:06,2021-04-2316:01:32
TheyreThereTheirPapi,"What is the real reason behind repealing net neutrality?  Are their losses from cable subscribers that bad?  Are they trying to slow down online video streaming? All of the above?  I assume this is how cable TV probably started, then went on to be the channel package mess it is today. ",https://www.reddit.com/r/malaysia/comments/7enkwk,2017-11-23 04:53:51,2021-04-2316:01:32
SupremeRedditBot,"Congrats for reaching r/all/top/ (of the day, top 25) with your post!
&nbsp;

*****

*^I ^am ^a ^bot, ^probably ^quite ^annoying, ^I ^mean ^no ^harm ^though*

*^Message ^me ^to ^add ^your ^account ^or ^subreddit ^to ^my ^blacklist*",https://www.reddit.com/r/malaysia/comments/7enkwk,2017-11-23 07:10:43,2021-04-2316:01:32
Wesmosis,Up,https://www.reddit.com/r/malaysia/comments/7enkwk,2017-11-23 07:38:05,2021-04-2316:01:32
HRwells_19,"*Copied from another sub. Don't mind me*

These are the emails of the 5 people on the FCC roster.  **These are the five people deciding the future of the internet.**

The two women have come out as *No* votes.  We need only to convince **ONE** of the other members to flip to a *No* vote to save Net Neutrality.

Blow up their inboxes!

* Ajit Pai - Ajit.Pai@fcc.gov
* Mignon Clyburn - Mignon.Clyburn@fcc.gov
* Michael O'Reilly - Mike.O'Reilly@fcc.gov
* Brendan Carr - Brendan.Carr@fcc.gov
* Jessica Rosenworcel - Jessica.Rosenworcel@fcc.gov

Spread this comment around!  We need to go straight to the source.  Be **civil**, be **concise**, and make sure they understand that what they're about to do is UNAMERICAN.

Godspeed!",https://www.reddit.com/r/malaysia/comments/7enkwk,2017-11-23 08:25:32,2021-04-2316:01:32
spikemcc,"If they're stupids enough to wake up some hacktivists, they're better be prepared, I heard rumors for a while and if even a quarter is true, the 3rd world war could be online and a thousand times worst than the first and the second wars ...",https://www.reddit.com/r/malaysia/comments/7enkwk,2017-11-23 09:01:42,2021-04-2316:01:32
DrecksVerwaltung,But I thought you loved overpaying for shit,https://www.reddit.com/r/malaysia/comments/7enkwk,2017-11-23 16:24:32,2021-04-2316:01:32
