author,comment,URL,Comment Time,Crawl Time
BrownBravo,"This is turrible news. And upsetting for me since I was banking on the cable that came with the phone. I was going to replace the one in my car. Obviously can’t now since no car maker in their right mind would standardize the USBC at this point. 

Plus the only USBC adapter I have is the 10w one which came with the 11 Pro. I don’t use it because I don’t want to “fast” charge. I’ve noticed personally that my battery drains quicker from a “fast” charge. 

This should upset every prospective iPhone customer......meanwhile I wait online for my preorder.",https://www.reddit.com/r/malaysia/comments/jaidc5,2020-10-14 05:11:16,2021-04-2316:01:32
m_ttl_ng,"That's why it's ""only"" $699; you have to spend an extra ~$60 on the charger and headphones if you need them.",https://www.reddit.com/r/malaysia/comments/jaidc5,2020-10-14 03:22:48,2021-04-2316:01:32
carrotstix,"So when you’re buying the power brick, buy it from any other company than apple and not in an apple store either.",https://www.reddit.com/r/malaysia/comments/jaidc5,2020-10-14 05:17:15,2021-04-2316:01:32
,[deleted],https://www.reddit.com/r/malaysia/comments/jaidc5,2020-10-14 08:52:23,2021-04-2316:01:32
KingFacetious,It doesn’t really matter that the included charger is lightning to USB-C. I think many people probably have lightning to USB-A cables that are compatible with their USB-A charging adapters. iPhones have been using lightning for years and this one is no different.,https://www.reddit.com/r/malaysia/comments/jaidc5,2020-10-14 09:24:26,2021-04-2316:01:32
Kami_Gs1,iPhone SE here I stay.,https://www.reddit.com/r/malaysia/comments/jaidc5,2020-10-14 10:55:49,2021-04-2316:01:32
Vivid-Sun,Damn I was buying it just for the charger.,https://www.reddit.com/r/malaysia/comments/jaidc5,2020-10-14 11:53:29,2021-04-2316:01:32
kasper632,Imagine buying a new house fully furnished but when you walk in to use the bathroom you quickly realize the house didn’t come with toilets. Realtor tells you the reason for no toilets is “There’s plenty of toilets in the world.”,https://www.reddit.com/r/malaysia/comments/jaidc5,2020-10-14 22:45:22,2021-04-2316:01:32
PlayaFrmDaHimalaya,"Who cares y'all still buying one , sheep",https://www.reddit.com/r/malaysia/comments/jaidc5,2020-10-14 22:46:02,2021-04-2316:01:32
Frogyprod,"If apple really cared about e waste, they wouldn't make a new phone every year",https://www.reddit.com/r/malaysia/comments/jaidc5,2020-10-14 02:44:09,2021-04-2316:01:32
,[deleted],https://www.reddit.com/r/malaysia/comments/jaidc5,2020-10-14 02:36:14,2021-04-2316:01:32
kamekaze1024,"If this was lighting to USB- A, this would make sense and would be smart 

But this is lightning to USB-C, an adapter that many people don’t have and won’t know that they don’t have until they get this new phone. 

I don’t know if this is a smart move...",https://www.reddit.com/r/malaysia/comments/jaidc5,2020-10-14 03:56:40,2021-04-2316:01:32
Tway9966,"So to save the environment, Apple has effectively quadrupled their packaging output. 


You have to buy the phone, the charging brick, the charger/cable (doesn’t come with a brick), and the headphones. All separately. All with their own packaging. 

That’s completely absurd and environmentally irresponsible. 

Someone needs to call them out and more importantly, do something about it.

Edit: and they made their previous charging brick obsolete, forcing people to buy the new USB-C brick",https://www.reddit.com/r/malaysia/comments/jaidc5,2020-10-14 03:28:39,2021-04-2316:01:32
jayplus707,"Do old lightning cords work still?  I don’t see the big deal here.  I don’t need the cord, nor the headphones, or the brick.",https://www.reddit.com/r/malaysia/comments/jaidc5,2020-10-14 04:36:56,2021-04-2316:01:32
kushpeshin,"It’s not a defence, but remember when iPods didn’t have power adapters, maybe they are following from there.",https://www.reddit.com/r/malaysia/comments/jaidc5,2020-10-14 05:18:36,2021-04-2316:01:32
HunnidWattWarlock,#SoBrave,https://www.reddit.com/r/malaysia/comments/jaidc5,2020-10-14 01:58:20,2021-04-2316:01:32
LightsOut16900,Why the fuck do you people support this garbage company,https://www.reddit.com/r/malaysia/comments/jaidc5,2020-10-14 08:39:34,2021-04-2316:01:32
,[deleted],https://www.reddit.com/r/malaysia/comments/jaidc5,2020-10-14 05:04:17,2021-04-2316:01:32
DannyHayter,All older iPhone models also no longer come with power adapters or EarPods.,https://www.reddit.com/r/malaysia/comments/jaidc5,2020-10-14 05:05:20,2021-04-2316:01:32
tuscabam,"Here’s a $1000+ phone built for $100 on the backs of Chinese labor camps but we aren’t included accessories. We do sell them, for another couple hundred. Apple has become a disgusting company.",https://www.reddit.com/r/malaysia/comments/jaidc5,2020-10-14 02:11:44,2021-04-2316:01:32
,[deleted],https://www.reddit.com/r/malaysia/comments/jaidc5,2020-10-14 02:35:36,2021-04-2316:01:32
sitdownstandup,"Buds? Who cares.

No warp/fast charging brick that won't brick (heh) my new phone? Not so good.",https://www.reddit.com/r/malaysia/comments/jaidc5,2020-10-14 05:11:46,2021-04-2316:01:32
YeetCacti,"This is insane and tone-deaf.

Nintendo did this with the New Nintendo 3DS and people rioted in the streets. They haven't done it since because of how poorly it went.

What do you think is gonna happen when you scale that up to iPhones?",https://www.reddit.com/r/malaysia/comments/jaidc5,2020-10-14 05:14:27,2021-04-2316:01:32
Donner_Par_Tea_House,Y'all Mac people are chumps.,https://www.reddit.com/r/malaysia/comments/jaidc5,2020-10-14 05:17:19,2021-04-2316:01:32
sahils88,I just saw the Canadian prices of all phones and they are beyond reasonable. Can’t bother enough with the charger or cable or EarPods when I can’t even come to terms with the price.,https://www.reddit.com/r/malaysia/comments/jaidc5,2020-10-14 05:17:37,2021-04-2316:01:32
TheAmericanDiablo,Wait I have an iPhone 6s Plus and have been waiting for the 12 to upgrade. I wouldn’t be able to use my brick?,https://www.reddit.com/r/malaysia/comments/jaidc5,2020-10-14 05:18:31,2021-04-2316:01:32
burgonies,Remember when Facebook was playing a silent audio file so it would continue running in the background and not get preempted by the OS?,https://www.reddit.com/r/malaysia/comments/kenyhx,2020-12-17 12:21:27,2021-04-2316:01:32
neoanguiano,"so facebook is saying we are standing against apple, because theyre limiting our spying?",https://www.reddit.com/r/malaysia/comments/kenyhx,2020-12-17 16:23:36,2021-04-2316:01:32
royalewithcheese4272,"Man I really need to delete FB and IG, slimy company, shady business practices, anti consumer bullshit, lack of social responsibility,  not to mention the lizard for CEO",https://www.reddit.com/r/malaysia/comments/kenyhx,2020-12-17 11:36:11,2021-04-2316:01:32
Xenuist,"Both Apple and Facebook are evil corporations that only care about profits, but Apple’s priorities benefit me and my desire for privacy while Facebook’s absolutely do not. I hope Apple’s new privacy controls are so effective that they put Facebook out of business. Fuck Facebook.",https://www.reddit.com/r/malaysia/comments/kenyhx,2020-12-17 11:30:36,2021-04-2316:01:32
kaiush,Facebook could literally shoot someone in the street and people would still use it.,https://www.reddit.com/r/malaysia/comments/kenyhx,2020-12-17 12:07:37,2021-04-2316:01:32
solomar0,I’ve been off Facebook for a year and a half and only use Instagram in browser. The feed doesn’t change when you refresh the page it’s like 1000x less addicting. My screen time is down to 54 minutes a day average,https://www.reddit.com/r/malaysia/comments/kenyhx,2020-12-17 13:40:44,2021-04-2316:01:32
saltann12,"Still doesn’t explain how I’m advertised things that I’ve only *thought* about.

Edit: for example, I recently built a pc. I needed a desk, but I didn’t ever mention it out loud or search for one. I started getting ads on Instagram for the *exact* desk that would fit into  the corner I was going to put it in. It’s not a 90 degree corner. It has 2 other facets.",https://www.reddit.com/r/malaysia/comments/kenyhx,2020-12-17 10:53:43,2021-04-2316:01:32
cryptic_slays,"who would've known that a company that is solely based on collecting AS MUCH DATA as possible from your device wouldn't access your camera and microphone...

I can't really leave IG because all of my friends and family use it, and I do a lot of stuff on there... but I am happy that I never had a facebook account...",https://www.reddit.com/r/malaysia/comments/kenyhx,2020-12-17 12:22:40,2021-04-2316:01:32
middlemaniac,I trust Apple. I don’t trust facebook,https://www.reddit.com/r/malaysia/comments/kenyhx,2020-12-17 12:13:41,2021-04-2316:01:32
Olasg,It seems like a lot of people in my generation don’t care about social privacy anylonger and what company they use.,https://www.reddit.com/r/malaysia/comments/kenyhx,2020-12-17 14:32:49,2021-04-2316:01:32
,[deleted],https://www.reddit.com/r/malaysia/comments/kenyhx,2020-12-17 12:03:58,2021-04-2316:01:32
Tejasjjj,Yes that’s true. Honestly why didn’t anyone or even apple implement this before. Like it was there on laptops. The green dot for camera use. Anyways I’m glad iOS 14 has implemented it.,https://www.reddit.com/r/malaysia/comments/kenyhx,2020-12-17 11:45:07,2021-04-2316:01:32
-------I-------,"I'm so glad I never allowed Instagram camera access. Sure, it made posting something a lot of work, but at least I kept some privacy.",https://www.reddit.com/r/malaysia/comments/kenyhx,2020-12-17 13:32:25,2021-04-2316:01:32
Exist50,"The article says what's actually happening...

> ""We only access your camera when you tell us to — for example, when you swipe from Feed to Camera. We found and are fixing a bug in ‌iOS 14‌ Beta that mistakenly indicates that some people are using the camera when they aren't,"" the spokesperson said. ""We do not access your camera in those instances, and no content is recorded.""

People aren't even trying to hide the clickbait.",https://www.reddit.com/r/malaysia/comments/kenyhx,2020-12-17 11:15:36,2021-04-2316:01:32
lord_pizzabird,Makes you wonder if Instagram is still doing this on Windows tbh.  Microsoft enforces basically no rules or standards on their platform.,https://www.reddit.com/r/malaysia/comments/kenyhx,2020-12-17 13:15:09,2021-04-2316:01:32
ReasonReader,"I should have deleted the app from all of my devices when FB bought them out, but I finally did so when their shenanigans were reported.",https://www.reddit.com/r/malaysia/comments/kenyhx,2020-12-17 16:42:15,2021-04-2316:01:32
Jnewfield83,Remember when Facebook didn't own Instagram?,https://www.reddit.com/r/malaysia/comments/kenyhx,2020-12-17 17:09:38,2021-04-2316:01:32
chabybaloo,">Since the release of the ‌iOS 14‌ developer and public beta, a large number of popular apps, such as LinkedIn, Reddit, and TikTok, have been discovered to be covertly accessing clipboard data.

Wait what!",https://www.reddit.com/r/malaysia/comments/kenyhx,2020-12-17 18:32:50,2021-04-2316:01:32
poshmosh01,The biggest privacy breach is apps and accounts accessing your phone/gps/nav history knowing exactly where you have been been and how long you stay there and what your number is.,https://www.reddit.com/r/malaysia/comments/kenyhx,2020-12-17 12:56:21,2021-04-2316:01:32
SuperPoop,Pretty sure that was just a “bug”,https://www.reddit.com/r/malaysia/comments/kenyhx,2020-12-17 10:53:20,2021-04-2316:01:32
CrispyJelly,That's why I would love a phone with a physical switch to power the camera and microphone.,https://www.reddit.com/r/malaysia/comments/kenyhx,2020-12-17 17:42:45,2021-04-2316:01:32
NekoWithAttitude,Feel bad for whoever it was watching my phone camera rubbing against my balls through some thinass pants all day,https://www.reddit.com/r/malaysia/comments/kenyhx,2020-12-17 19:24:43,2021-04-2316:01:32
z3r0xcool,But remember when Apple put u2’s whole album on your phone without asking,https://www.reddit.com/r/malaysia/comments/kenyhx,2020-12-17 23:18:44,2021-04-2316:01:32
erikasnoske123,"It does not matter if you are Android or Apple fan, but let's agree - Facebook should go out of business. One of the worst things to society.",https://www.reddit.com/r/malaysia/comments/kenyhx,2020-12-17 14:43:46,2021-04-2316:01:32
Administrator-Reddit,"I’ve always suspected that Facebook somehow pulls your address book data even when you don’t allow it access. 

Years ago when I still had an FB account, I was getting “People you may know” suggestions which completely baffled me because these were clients I knew IRL but they and I didn’t have mutual friends on FB. And it wasn’t just one or two, I was getting over a dozen such suggestions. The only possibility I can think of is FB somehow got my address book or email lists, which I couldn’t understand because I’ve never given FB access to my address book before.",https://www.reddit.com/r/malaysia/comments/kenyhx,2020-12-17 13:27:28,2021-04-2316:01:32
elpese,"Facebook stopped making friend suggestions for me several years ago, across devices. I have no idea how or why this happened, but I am not complaining.",https://www.reddit.com/r/malaysia/comments/kenyhx,2020-12-17 13:45:53,2021-04-2316:01:32
fullhe425,Is there a way to clear your data from their system for good,https://www.reddit.com/r/malaysia/comments/kenyhx,2020-12-17 13:03:05,2021-04-2316:01:32
LurkingChessplayer,Do they still do that on Android?,https://www.reddit.com/r/malaysia/comments/kenyhx,2020-12-17 15:05:30,2021-04-2316:01:32
kejok,"I still got green dot indicator now and then when opening instagram for no apparent reason. Haven’t opened camera whatsoever just scrolling through timeline and the dot pop up, I immediately force closed instagram and reopen it",https://www.reddit.com/r/malaysia/comments/kenyhx,2020-12-17 15:22:21,2021-04-2316:01:32
King_Quindarious,"Hm, I never noticed because I never gave camera access",https://www.reddit.com/r/malaysia/comments/kenyhx,2020-12-17 15:22:50,2021-04-2316:01:32
Sobemiki,{laughs nervously from ios13},https://www.reddit.com/r/malaysia/comments/kenyhx,2020-12-17 15:45:46,2021-04-2316:01:32
themintfreshness,"So, while I agree fuck Facebook, y’all just gonna ignore Reddit was named in that article. What was Reddit accused of doing? I use Apollo so I haven’t had any issues that I know of, but I’m curious now.",https://www.reddit.com/r/malaysia/comments/kenyhx,2020-12-17 19:26:31,2021-04-2316:01:32
bryanalexander,"Deleted Facebook, WhatsApp, and Instagram today. Couldn’t be happier.",https://www.reddit.com/r/malaysia/comments/kenyhx,2020-12-17 19:39:32,2021-04-2316:01:32
mrchumblie,Fuck Facebook.,https://www.reddit.com/r/malaysia/comments/kenyhx,2020-12-17 21:37:58,2021-04-2316:01:32
SkunkMonkey,Something something glass houses something something.,https://www.reddit.com/r/malaysia/comments/kenyhx,2020-12-17 23:46:55,2021-04-2316:01:32
crashcondo,Facebook can go right to hell.,https://www.reddit.com/r/malaysia/comments/kenyhx,2020-12-17 23:46:55,2021-04-2316:01:32
g3jin,Gotta love blame shifting,https://www.reddit.com/r/malaysia/comments/kenyhx,2020-12-17 23:50:39,2021-04-2316:01:32
chasemccl,remember to turn off microphone access... that way they can't listen to your conversations,https://www.reddit.com/r/malaysia/comments/kenyhx,2020-12-18 01:57:47,2021-04-2316:01:32
Slaed_Dweller,"I really don't take Facebook's side, but I do think Apple should be held to the same standards. 

~~Their apps should also tell people what data is being used or what is being accessed.~~

EDIT: Apple does tell users what their apps are accessing. I apologize.",https://www.reddit.com/r/malaysia/comments/kenyhx,2020-12-17 11:54:31,2021-04-2316:01:32
Kevin_2112,"Over the past few weeks, I thought I should stop using Instagram. Now I'm sure I want to.",https://www.reddit.com/r/malaysia/comments/kenyhx,2020-12-17 13:35:41,2021-04-2316:01:32
ebkbk,Fuck Facebook! Fight me.,https://www.reddit.com/r/malaysia/comments/kenyhx,2020-12-17 11:32:57,2021-04-2316:01:32
CollegeAssDiscoDorm,They're all as crooked as a barrel of snakes. The fact is our data is one of the most valuable commodities out there and we hand it over for a free email app. I think we should be able to sell our data since these tech giants are so interested in commoditizing it.,https://www.reddit.com/r/malaysia/comments/kenyhx,2020-12-18 02:56:00,2021-04-2316:01:32
mrstagerager,[Obligatory](https://youtu.be/Ze_m_G2QxaI?t=29),https://www.reddit.com/r/malaysia/comments/kenyhx,2020-12-17 11:41:58,2021-04-2316:01:32
shinobipopcorn,"Wanna know why I buy Japanese phones instead of the equivalent US model? Aside from still having the phone strap hole (which is a life saver if you always drop your phone), they don't have all these annoying/spying apps pre-installed and impossible to remove.",https://www.reddit.com/r/malaysia/comments/kenyhx,2020-12-17 14:32:20,2021-04-2316:01:32
Nice-N-Eazy,"What if I only use FB and IG for my hobby? Is there a better alternative? I used to be active on web forums, but nowadays they aren’t as popular.",https://www.reddit.com/r/malaysia/comments/kenyhx,2020-12-17 15:11:36,2021-04-2316:01:32
fitzwho,All I saw was the title of this thread and I just went through and deleted my Facebook and Messenger apps. Thanks for reminding me to delete these.,https://www.reddit.com/r/malaysia/comments/kenyhx,2020-12-17 15:31:55,2021-04-2316:01:32
JennVell,*checks to make sure iOS 14 is on phone.*,https://www.reddit.com/r/malaysia/comments/kenyhx,2020-12-17 15:47:58,2021-04-2316:01:32
transphobicfag,Yet people will keep using these garbage platforms,https://www.reddit.com/r/malaysia/comments/kenyhx,2020-12-17 16:05:47,2021-04-2316:01:32
supasonic07,"I have a question regarding the wholy spy thing.   
If I have this app in my iPhone, but I disable / take away the permission to use Mic/Camera. Would this ""bug"" still occur?",https://www.reddit.com/r/malaysia/comments/kenyhx,2020-12-17 16:18:30,2021-04-2316:01:32
,I remember Playstation Underground.,https://www.reddit.com/r/malaysia/comments/kenyhx,2020-12-17 18:45:35,2021-04-2316:01:32
pnunud,How do I effectively report a major app that still accesses photos severely and has been doing so for the past few years despite disabling access and making sure privacy settings are strict?,https://www.reddit.com/r/malaysia/comments/kenyhx,2020-12-17 19:37:18,2021-04-2316:01:32
Axelpanic,I’m still trying to figure out why Facebook needs Bluetooth permission.,https://www.reddit.com/r/malaysia/comments/kenyhx,2020-12-17 20:28:54,2021-04-2316:01:32
,This is why I only use social media services in a browser,https://www.reddit.com/r/malaysia/comments/kenyhx,2020-12-17 21:22:35,2021-04-2316:01:32
troliram,"but how did Instagram had access to camera up until iOS 14?
Was this security issue?",https://www.reddit.com/r/malaysia/comments/kenyhx,2020-12-17 21:45:57,2021-04-2316:01:32
PeasantSteve,"While I prefer android to iOS, apple's current stance on privacy is making me seriously consider an iPhone for my next phone.",https://www.reddit.com/r/malaysia/comments/kenyhx,2020-12-17 22:13:26,2021-04-2316:01:32
yunghoopla,Facebook is not standing up for the common man here they just don’t want to lose $$$,https://www.reddit.com/r/malaysia/comments/kenyhx,2020-12-17 23:33:34,2021-04-2316:01:32
tangledtongue,"I mean what do people expect for free apps? I’m not saying what they’re doing is right, but, if you’re no paying for it, you are the product. They don’t put out apps out of the kindness of their hearts, they do it because there is something to gain from it.",https://www.reddit.com/r/malaysia/comments/kenyhx,2020-12-18 00:55:58,2021-04-2316:01:32
Kranon7,I am curious if Facebook really thought people would be on their side that they put out this full page ad about it.,https://www.reddit.com/r/malaysia/comments/kenyhx,2020-12-18 00:56:10,2021-04-2316:01:32
DeadlyImpulseGaming,Privacy exist no more with all these phones and technology,https://www.reddit.com/r/malaysia/comments/kenyhx,2020-12-18 01:23:12,2021-04-2316:01:32
vahid83,It's funny how people think Apple is the good guy in this battle!,https://www.reddit.com/r/malaysia/comments/kenyhx,2020-12-18 04:27:36,2021-04-2316:01:32
MaxHedrome,"Mark Zuckerberg, more like Mark Zuckmahturd

amirite


...I'll be here til Wednesday",https://www.reddit.com/r/malaysia/comments/kenyhx,2020-12-18 07:17:57,2021-04-2316:01:32
sulaymanf,"Parler CEO: ""Every vendor from text message services to email providers to our lawyers all ditched us."" Hardly just Apple or Google.",https://www.reddit.com/r/malaysia/comments/kv23bx,2021-01-11 23:06:34,2021-04-2316:01:32
Boggie135,"*“Every vendor from text message services to email providers to our lawyers all ditched us too on the same day,” Matze said today on Fox News.*

It's pretty bad when the lawyers leave",https://www.reddit.com/r/malaysia/comments/kv23bx,2021-01-11 22:51:04,2021-04-2316:01:32
,[deleted],https://www.reddit.com/r/malaysia/comments/kv23bx,2021-01-11 21:40:55,2021-04-2316:01:32
lowrankcluster,So private companies don’t have right to choose who they want to do business with? Gay wedding cake my ass.,https://www.reddit.com/r/malaysia/comments/kv23bx,2021-01-11 21:11:40,2021-04-2316:01:32
encarded,"It appears that the people behind Parler are also the people behind Cambridge Analytica and the support of Trump and Brexit, so their choice to allow their platform to both foster and manipulate extreme and violent views doesn't get them any brownie point, IMO. Tough beans, free market proponents...

Edit: thanks for the silver and gold. The more you watch and read about this stuff the more connections there are. Not conspiracy-theory style connections, but actual real life ones. The deep dive books we will have to read in 5 years will be wild and terrifying.",https://www.reddit.com/r/malaysia/comments/kv23bx,2021-01-11 21:43:18,2021-04-2316:01:32
SirTigel,Oh no. Anyway...,https://www.reddit.com/r/malaysia/comments/kv23bx,2021-01-11 21:24:06,2021-04-2316:01:32
hsvbamabeau,What is more disturbing here is the rise in corporate dependence on cloud-based services. These companies are not in control of their company products but instead by the cloud-base service provider. Imagine how much power has been concentrated by these cloud-based service providers such that they can cripple thousands of companies with a flick of a switch.,https://www.reddit.com/r/malaysia/comments/kv23bx,2021-01-12 00:16:37,2021-04-2316:01:32
kadinshino,"I remember when parler had little do with politics...i. actually had my gaming channel mirrored there. wtf happened.

the only reason I went there was looking for alternatives to twitch and youtube. and it was mostly to get away from not getting demonetized for using the word corona....",https://www.reddit.com/r/malaysia/comments/kv23bx,2021-01-11 22:46:31,2021-04-2316:01:32
DanTheMan827,At least people can comment here without having a flair unlike some other subs,https://www.reddit.com/r/malaysia/comments/kv23bx,2021-01-12 00:15:46,2021-04-2316:01:32
aDankSpazxtic,Someordinarygamer predicted this holy fuck,https://www.reddit.com/r/malaysia/comments/kv23bx,2021-01-12 06:57:08,2021-04-2316:01:32
sohrobby,It’s funny to hear Parler whine about censorship and being deplatformed when they regularly removed everyone on their site who held liberal viewpoints. They practiced censorship and removing of accounts on a regular basis.,https://www.reddit.com/r/malaysia/comments/kv23bx,2021-01-12 19:47:51,2021-04-2316:01:32
brucelilwayne15,Quick one of you should take nazismingle.com before somebody snatches it up,https://www.reddit.com/r/malaysia/comments/kv23bx,2021-01-12 03:02:39,2021-04-2316:01:32
,[deleted],https://www.reddit.com/r/malaysia/comments/kv23bx,2021-01-11 22:04:49,2021-04-2316:01:32
,[deleted],https://www.reddit.com/r/malaysia/comments/kv23bx,2021-01-11 21:03:25,2021-04-2316:01:32
ThankYouJoeVeryCool,"This is going to used in the antitrust cases against Apple, Google, and Amazon. These 3 companies can make or break a business.",https://www.reddit.com/r/malaysia/comments/kv23bx,2021-01-11 21:59:22,2021-04-2316:01:32
pwnedkiller,Hahah and this guy talked like he wasn’t worried about the Amazon shut down.,https://www.reddit.com/r/malaysia/comments/kv23bx,2021-01-12 03:15:38,2021-04-2316:01:32
GraveyDeluxe,Yeah. It was for sure the tech companies that ruined this very not terroristy app lol,https://www.reddit.com/r/malaysia/comments/kv23bx,2021-01-12 03:29:00,2021-04-2316:01:32
drknox,"Why don’t you just stop being so god damn lazy, and pull yourself up by the bootstraps. You deserve to fail if you can’t even compete. Damn commie snowflakes, always thinking they are owed something!
 /s",https://www.reddit.com/r/malaysia/comments/kv23bx,2021-01-12 07:09:53,2021-04-2316:01:32
True_FX,"Weren't Twitter and Facebook used to coordinate all of the riots, looting, destruction of public property, harassing public officials at their homes and assaults during 2020?  Why are those apps still allowed to function?",https://www.reddit.com/r/malaysia/comments/kv23bx,2021-01-12 05:22:18,2021-04-2316:01:32
shingg919,Does anyone feel that the power of these companies is a bit too strong?,https://www.reddit.com/r/malaysia/comments/kv23bx,2021-01-11 22:15:07,2021-04-2316:01:32
sds101,They'll be fine! They can just pull themselves up by the bootstraps!,https://www.reddit.com/r/malaysia/comments/kv23bx,2021-01-12 07:00:22,2021-04-2316:01:32
V8der66,He blames Apple and Google but not those traitorous Trumpers?!,https://www.reddit.com/r/malaysia/comments/kv23bx,2021-01-12 02:25:16,2021-04-2316:01:32
wise_joe,Can someone in the US explain to me why they were planning to execute Mike Pence? What did he do wrong?,https://www.reddit.com/r/malaysia/comments/kv23bx,2021-01-11 23:11:24,2021-04-2316:01:32
