title,score,url_id,comms_num,created,body,timestamp,url
Join the battle for net neutrality!!! We don’t wanna have to pay for reddit!! Do you part!,67770,7enkwk,483,1511347898.0,,2017-11-22 18:51:38,https://www.reddit.com/r/malaysia/comments/7enkwk
iPhone 12 does not come with power charger or earbuds in the box,50363,jaidc5,7645,1602639736.0,,2020-10-14 09:42:16,https://www.reddit.com/r/malaysia/comments/jaidc5
"In light of Facebook's whining about Apple, remember that Instagram secretly accessed your camera until outed by iOS 14",43117,kenyhx,1751,1608200085.0,,2020-12-17 18:14:45,https://www.reddit.com/r/malaysia/comments/kenyhx
Parler app and website go offline; CEO blames Apple and Google for destroying the company,42019,kv23bx,4427,1610398540.0,,2021-01-12 04:55:40,https://www.reddit.com/r/malaysia/comments/kv23bx
Fornite has been removed from the App Store after they implemented direct payments,41590,i95vei,5950,1597373783.0,,2020-08-14 10:56:23,https://www.reddit.com/r/malaysia/comments/i95vei
Phone Calls Will Finally Stop Taking Up the Entire Screen in iOS 14,40152,hdxmzf,1637,1592878761.0,,2020-06-23 10:19:21,https://www.reddit.com/r/malaysia/comments/hdxmzf
